Sheet: Patients
A1: ID | B1: Name | C1: Birthyear | D1: Age | E1: Sex | F1: EU | G1: Insurance | H1: Phone | I1: Languages | J1: Last Appointment | K1: Last Reason | L1: Last Doc
A2: P1 | B2: Powell | C2: 2000-01-01 | D2: of:=IF(ISBLANK([.C2]); ""; ORG.OPENOFFICE.YEARS([.$C2];TODAY();0)) -> 20 | E2: m | F2: no | G2: no | H2: 1234567 | I2: English;Spanish | J2: of:=IF(IFNA(COM.MICROSOFT.MAXIFS([$Appointments.$F$1:$Appointments.$F$1048576];[$Appointments.$B$1:$Appointments.$B$1048576];[.A2]); "")=0; ""; IFNA(COM.MICROSOFT.MAXIFS([$Appointments.$F$1:$Appointments.$F$1048576];[$Appointments.$B$1:$Appointments.$B$1048576];[.A2]); "")) -> 2020-02-01 | K2: of:=IF(IFNA(INDEX([$Appointments.G$1:$Appointments.G$1048576]; MATCH([.A2]&[.J2]; [$Appointments.$B$1:$Appointments.$B$1048576]&[$Appointments.$F$1:$Appointments.$F$1048576]; 0)); "")=0; ""; IFNA(INDEX([$Appointments.G$1:$Appointments.G$1048576]; MATCH([.A2]&[.J2]; [$Appointments.$B$1:$Appointments.$B$1048576]&[$Appointments.$F$1:$Appointments.$F$1048576]; 0)); "")) -> Cough | L2: of:=IFNA(INDEX([$Doc.$B$1:$Doc.$B$1048576]; MATCH(INDEX([$Appointments.$D$1:$Appointments.$D$1048576]; MATCH([.$A2]&[.$J2]; [$Appointments.$B$1:$Appointments.$B$1048576]&[$Appointments.$F$1:$Appointments.$F$1048576]; 0)); [$Doc.$A$1:$Doc.$A$1048576]; 0)); "") -> Don
A3: P2 | B3: Pablo | D3: of:=IF(ISBLANK([.C3]); ""; ORG.OPENOFFICE.YEARS([.$C3];TODAY();0)) ->  | E3: f | F3: yes | H3: 1234567 | J3: of:=IF(IFNA(COM.MICROSOFT.MAXIFS([$Appointments.$F$1:$Appointments.$F$1048576];[$Appointments.$B$1:$Appointments.$B$1048576];[.A3]); "")=0; ""; IFNA(COM.MICROSOFT.MAXIFS([$Appointments.$F$1:$Appointments.$F$1048576];[$Appointments.$B$1:$Appointments.$B$1048576];[.A3]); "")) -> 2020-02-02 | K3: of:=IF(IFNA(INDEX([$Appointments.G$1:$Appointments.G$1048576]; MATCH([.A3]&[.J3]; [$Appointments.$B$1:$Appointments.$B$1048576]&[$Appointments.$F$1:$Appointments.$F$1048576]; 0)); "")=0; ""; IFNA(INDEX([$Appointments.G$1:$Appointments.G$1048576]; MATCH([.A3]&[.J3]; [$Appointments.$B$1:$Appointments.$B$1048576]&[$Appointments.$F$1:$Appointments.$F$1048576]; 0)); "")) -> Heartache | L3: of:=IFNA(INDEX([$Doc.$B$1:$Doc.$B$1048576]; MATCH(INDEX([$Appointments.$D$1:$Appointments.$D$1048576]; MATCH([.$A3]&[.$J3]; [$Appointments.$B$1:$Appointments.$B$1048576]&[$Appointments.$F$1:$Appointments.$F$1048576]; 0)); [$Doc.$A$1:$Doc.$A$1048576]; 0)); "") -> Diablo
A4: P3 | B4: Pavel | D4: of:=IF(ISBLANK([.C4]); ""; ORG.OPENOFFICE.YEARS([.$C4];TODAY();0)) ->  | E4: o | F4: no | H4: 1234567 | J4: of:=IF(IFNA(COM.MICROSOFT.MAXIFS([$Appointments.$F$1:$Appointments.$F$1048576];[$Appointments.$B$1:$Appointments.$B$1048576];[.A4]); "")=0; ""; IFNA(COM.MICROSOFT.MAXIFS([$Appointments.$F$1:$Appointments.$F$1048576];[$Appointments.$B$1:$Appointments.$B$1048576];[.A4]); "")) -> 2020-02-20 | K4: of:=IF(IFNA(INDEX([$Appointments.G$1:$Appointments.G$1048576]; MATCH([.A4]&[.J4]; [$Appointments.$B$1:$Appointments.$B$1048576]&[$Appointments.$F$1:$Appointments.$F$1048576]; 0)); "")=0; ""; IFNA(INDEX([$Appointments.G$1:$Appointments.G$1048576]; MATCH([.A4]&[.J4]; [$Appointments.$B$1:$Appointments.$B$1048576]&[$Appointments.$F$1:$Appointments.$F$1048576]; 0)); "")) -> bang | L4: of:=IFNA(INDEX([$Doc.$B$1:$Doc.$B$1048576]; MATCH(INDEX([$Appointments.$D$1:$Appointments.$D$1048576]; MATCH([.$A4]&[.$J4]; [$Appointments.$B$1:$Appointments.$B$1048576]&[$Appointments.$F$1:$Appointments.$F$1048576]; 0)); [$Doc.$A$1:$Doc.$A$1048576]; 0)); "") -> Diane
A5: P4 | B5: Pol | D5: of:=IF(ISBLANK([.C5]); ""; ORG.OPENOFFICE.YEARS([.$C5];TODAY();0)) ->  | E5: f | F5: yes | J5: of:=IF(IFNA(COM.MICROSOFT.MAXIFS([$Appointments.$F$1:$Appointments.$F$1048576];[$Appointments.$B$1:$Appointments.$B$1048576];[.A5]); "")=0; ""; IFNA(COM.MICROSOFT.MAXIFS([$Appointments.$F$1:$Appointments.$F$1048576];[$Appointments.$B$1:$Appointments.$B$1048576];[.A5]); "")) -> 2020-02-16 | K5: of:=IF(IFNA(INDEX([$Appointments.G$1:$Appointments.G$1048576]; MATCH([.A5]&[.J5]; [$Appointments.$B$1:$Appointments.$B$1048576]&[$Appointments.$F$1:$Appointments.$F$1048576]; 0)); "")=0; ""; IFNA(INDEX([$Appointments.G$1:$Appointments.G$1048576]; MATCH([.A5]&[.J5]; [$Appointments.$B$1:$Appointments.$B$1048576]&[$Appointments.$F$1:$Appointments.$F$1048576]; 0)); "")) -> zeppo | L5: of:=IFNA(INDEX([$Doc.$B$1:$Doc.$B$1048576]; MATCH(INDEX([$Appointments.$D$1:$Appointments.$D$1048576]; MATCH([.$A5]&[.$J5]; [$Appointments.$B$1:$Appointments.$B$1048576]&[$Appointments.$F$1:$Appointments.$F$1048576]; 0)); [$Doc.$A$1:$Doc.$A$1048576]; 0)); "") -> Donna
A6: P5 | B6: Pille | D6: of:=IF(ISBLANK([.C6]); ""; ORG.OPENOFFICE.YEARS([.$C6];TODAY();0)) ->  | E6: m | F6: no | J6: of:=IF(IFNA(COM.MICROSOFT.MAXIFS([$Appointments.$F$1:$Appointments.$F$1048576];[$Appointments.$B$1:$Appointments.$B$1048576];[.A6]); "")=0; ""; IFNA(COM.MICROSOFT.MAXIFS([$Appointments.$F$1:$Appointments.$F$1048576];[$Appointments.$B$1:$Appointments.$B$1048576];[.A6]); "")) -> 2020-02-17 | K6: of:=IF(IFNA(INDEX([$Appointments.G$1:$Appointments.G$1048576]; MATCH([.A6]&[.J6]; [$Appointments.$B$1:$Appointments.$B$1048576]&[$Appointments.$F$1:$Appointments.$F$1048576]; 0)); "")=0; ""; IFNA(INDEX([$Appointments.G$1:$Appointments.G$1048576]; MATCH([.A6]&[.J6]; [$Appointments.$B$1:$Appointments.$B$1048576]&[$Appointments.$F$1:$Appointments.$F$1048576]; 0)); "")) -> ziro | L6: of:=IFNA(INDEX([$Doc.$B$1:$Doc.$B$1048576]; MATCH(INDEX([$Appointments.$D$1:$Appointments.$D$1048576]; MATCH([.$A6]&[.$J6]; [$Appointments.$B$1:$Appointments.$B$1048576]&[$Appointments.$F$1:$Appointments.$F$1048576]; 0)); [$Doc.$A$1:$Doc.$A$1048576]; 0)); "") -> 
A7: P6 | B7: Pong | D7: of:=IF(ISBLANK([.C7]); ""; ORG.OPENOFFICE.YEARS([.$C7];TODAY();0)) ->  | E7: f | F7: yes | J7: of:=IF(IFNA(COM.MICROSOFT.MAXIFS([$Appointments.$F$1:$Appointments.$F$1048576];[$Appointments.$B$1:$Appointments.$B$1048576];[.A7]); "")=0; ""; IFNA(COM.MICROSOFT.MAXIFS([$Appointments.$F$1:$Appointments.$F$1048576];[$Appointments.$B$1:$Appointments.$B$1048576];[.A7]); "")) -> 2020-02-05 | K7: of:=IF(IFNA(INDEX([$Appointments.G$1:$Appointments.G$1048576]; MATCH([.A7]&[.J7]; [$Appointments.$B$1:$Appointments.$B$1048576]&[$Appointments.$F$1:$Appointments.$F$1048576]; 0)); "")=0; ""; IFNA(INDEX([$Appointments.G$1:$Appointments.G$1048576]; MATCH([.A7]&[.J7]; [$Appointments.$B$1:$Appointments.$B$1048576]&[$Appointments.$F$1:$Appointments.$F$1048576]; 0)); "")) -> you | L7: of:=IFNA(INDEX([$Doc.$B$1:$Doc.$B$1048576]; MATCH(INDEX([$Appointments.$D$1:$Appointments.$D$1048576]; MATCH([.$A7]&[.$J7]; [$Appointments.$B$1:$Appointments.$B$1048576]&[$Appointments.$F$1:$Appointments.$F$1048576]; 0)); [$Doc.$A$1:$Doc.$A$1048576]; 0)); "") -> Dean
A8: P7 | B8: Perk | D8: of:=IF(ISBLANK([.C8]); ""; ORG.OPENOFFICE.YEARS([.$C8];TODAY();0)) ->  | E8: m | F8: no | J8: of:=IF(IFNA(COM.MICROSOFT.MAXIFS([$Appointments.$F$1:$Appointments.$F$1048576];[$Appointments.$B$1:$Appointments.$B$1048576];[.A8]); "")=0; ""; IFNA(COM.MICROSOFT.MAXIFS([$Appointments.$F$1:$Appointments.$F$1048576];[$Appointments.$B$1:$Appointments.$B$1048576];[.A8]); "")) -> 2020-02-06 | K8: of:=IF(IFNA(INDEX([$Appointments.G$1:$Appointments.G$1048576]; MATCH([.A8]&[.J8]; [$Appointments.$B$1:$Appointments.$B$1048576]&[$Appointments.$F$1:$Appointments.$F$1048576]; 0)); "")=0; ""; IFNA(INDEX([$Appointments.G$1:$Appointments.G$1048576]; MATCH([.A8]&[.J8]; [$Appointments.$B$1:$Appointments.$B$1048576]&[$Appointments.$F$1:$Appointments.$F$1048576]; 0)); "")) -> us | L8: of:=IFNA(INDEX([$Doc.$B$1:$Doc.$B$1048576]; MATCH(INDEX([$Appointments.$D$1:$Appointments.$D$1048576]; MATCH([.$A8]&[.$J8]; [$Appointments.$B$1:$Appointments.$B$1048576]&[$Appointments.$F$1:$Appointments.$F$1048576]; 0)); [$Doc.$A$1:$Doc.$A$1048576]; 0)); "") -> Donna
A9: P8 | B9: Pal | D9: of:=IF(ISBLANK([.C9]); ""; ORG.OPENOFFICE.YEARS([.$C9];TODAY();0)) ->  | E9: f | F9: yes | J9: of:=IF(IFNA(COM.MICROSOFT.MAXIFS([$Appointments.$F$1:$Appointments.$F$1048576];[$Appointments.$B$1:$Appointments.$B$1048576];[.A9]); "")=0; ""; IFNA(COM.MICROSOFT.MAXIFS([$Appointments.$F$1:$Appointments.$F$1048576];[$Appointments.$B$1:$Appointments.$B$1048576];[.A9]); "")) -> 2020-02-07 | K9: of:=IF(IFNA(INDEX([$Appointments.G$1:$Appointments.G$1048576]; MATCH([.A9]&[.J9]; [$Appointments.$B$1:$Appointments.$B$1048576]&[$Appointments.$F$1:$Appointments.$F$1048576]; 0)); "")=0; ""; IFNA(INDEX([$Appointments.G$1:$Appointments.G$1048576]; MATCH([.A9]&[.J9]; [$Appointments.$B$1:$Appointments.$B$1048576]&[$Appointments.$F$1:$Appointments.$F$1048576]; 0)); "")) -> Whatevs | L9: of:=IFNA(INDEX([$Doc.$B$1:$Doc.$B$1048576]; MATCH(INDEX([$Appointments.$D$1:$Appointments.$D$1048576]; MATCH([.$A9]&[.$J9]; [$Appointments.$B$1:$Appointments.$B$1048576]&[$Appointments.$F$1:$Appointments.$F$1048576]; 0)); [$Doc.$A$1:$Doc.$A$1048576]; 0)); "") -> Dingo
A10: P9 | B10: Ding | D10: of:=IF(ISBLANK([.C10]); ""; ORG.OPENOFFICE.YEARS([.$C10];TODAY();0)) ->  | E10: o | F10: no | J10: of:=IF(IFNA(COM.MICROSOFT.MAXIFS([$Appointments.$F$1:$Appointments.$F$1048576];[$Appointments.$B$1:$Appointments.$B$1048576];[.A10]); "")=0; ""; IFNA(COM.MICROSOFT.MAXIFS([$Appointments.$F$1:$Appointments.$F$1048576];[$Appointments.$B$1:$Appointments.$B$1048576];[.A10]); "")) ->  | K10: of:=IF(IFNA(INDEX([$Appointments.G$1:$Appointments.G$1048576]; MATCH([.A10]&[.J10]; [$Appointments.$B$1:$Appointments.$B$1048576]&[$Appointments.$F$1:$Appointments.$F$1048576]; 0)); "")=0; ""; IFNA(INDEX([$Appointments.G$1:$Appointments.G$1048576]; MATCH([.A10]&[.J10]; [$Appointments.$B$1:$Appointments.$B$1048576]&[$Appointments.$F$1:$Appointments.$F$1048576]; 0)); "")) ->  | L10: of:=IFNA(INDEX([$Doc.$B$1:$Doc.$B$1048576]; MATCH(INDEX([$Appointments.$D$1:$Appointments.$D$1048576]; MATCH([.$A10]&[.$J10]; [$Appointments.$B$1:$Appointments.$B$1048576]&[$Appointments.$F$1:$Appointments.$F$1048576]; 0)); [$Doc.$A$1:$Doc.$A$1048576]; 0)); "") -> 
A11: P10 | B11: Dong | D11: of:=IF(ISBLANK([.C11]); ""; ORG.OPENOFFICE.YEARS([.$C11];TODAY();0)) ->  | E11: f | F11: yes | J11: of:=IF(IFNA(COM.MICROSOFT.MAXIFS([$Appointments.$F$1:$Appointments.$F$1048576];[$Appointments.$B$1:$Appointments.$B$1048576];[.A11]); "")=0; ""; IFNA(COM.MICROSOFT.MAXIFS([$Appointments.$F$1:$Appointments.$F$1048576];[$Appointments.$B$1:$Appointments.$B$1048576];[.A11]); "")) ->  | K11: of:=IF(IFNA(INDEX([$Appointments.G$1:$Appointments.G$1048576]; MATCH([.A11]&[.J11]; [$Appointments.$B$1:$Appointments.$B$1048576]&[$Appointments.$F$1:$Appointments.$F$1048576]; 0)); "")=0; ""; IFNA(INDEX([$Appointments.G$1:$Appointments.G$1048576]; MATCH([.A11]&[.J11]; [$Appointments.$B$1:$Appointments.$B$1048576]&[$Appointments.$F$1:$Appointments.$F$1048576]; 0)); "")) ->  | L11: of:=IFNA(INDEX([$Doc.$B$1:$Doc.$B$1048576]; MATCH(INDEX([$Appointments.$D$1:$Appointments.$D$1048576]; MATCH([.$A11]&[.$J11]; [$Appointments.$B$1:$Appointments.$B$1048576]&[$Appointments.$F$1:$Appointments.$F$1048576]; 0)); [$Doc.$A$1:$Doc.$A$1048576]; 0)); "") -> 
A12: P11 | B12: Däng | D12: of:=IF(ISBLANK([.C12]); ""; ORG.OPENOFFICE.YEARS([.$C12];TODAY();0)) ->  | E12: m | F12: no | J12: of:=IF(IFNA(COM.MICROSOFT.MAXIFS([$Appointments.$F$1:$Appointments.$F$1048576];[$Appointments.$B$1:$Appointments.$B$1048576];[.A12]); "")=0; ""; IFNA(COM.MICROSOFT.MAXIFS([$Appointments.$F$1:$Appointments.$F$1048576];[$Appointments.$B$1:$Appointments.$B$1048576];[.A12]); "")) ->  | K12: of:=IF(IFNA(INDEX([$Appointments.G$1:$Appointments.G$1048576]; MATCH([.A12]&[.J12]; [$Appointments.$B$1:$Appointments.$B$1048576]&[$Appointments.$F$1:$Appointments.$F$1048576]; 0)); "")=0; ""; IFNA(INDEX([$Appointments.G$1:$Appointments.G$1048576]; MATCH([.A12]&[.J12]; [$Appointments.$B$1:$Appointments.$B$1048576]&[$Appointments.$F$1:$Appointments.$F$1048576]; 0)); "")) ->  | L12: of:=IFNA(INDEX([$Doc.$B$1:$Doc.$B$1048576]; MATCH(INDEX([$Appointments.$D$1:$Appointments.$D$1048576]; MATCH([.$A12]&[.$J12]; [$Appointments.$B$1:$Appointments.$B$1048576]&[$Appointments.$F$1:$Appointments.$F$1048576]; 0)); [$Doc.$A$1:$Doc.$A$1048576]; 0)); "") -> 
A13: P12 | B13: Dork | D13: of:=IF(ISBLANK([.C13]); ""; ORG.OPENOFFICE.YEARS([.$C13];TODAY();0)) ->  | E13: f | F13: yes | J13: of:=IF(IFNA(COM.MICROSOFT.MAXIFS([$Appointments.$F$1:$Appointments.$F$1048576];[$Appointments.$B$1:$Appointments.$B$1048576];[.A13]); "")=0; ""; IFNA(COM.MICROSOFT.MAXIFS([$Appointments.$F$1:$Appointments.$F$1048576];[$Appointments.$B$1:$Appointments.$B$1048576];[.A13]); "")) -> 2020-02-15 | K13: of:=IF(IFNA(INDEX([$Appointments.G$1:$Appointments.G$1048576]; MATCH([.A13]&[.J13]; [$Appointments.$B$1:$Appointments.$B$1048576]&[$Appointments.$F$1:$Appointments.$F$1048576]; 0)); "")=0; ""; IFNA(INDEX([$Appointments.G$1:$Appointments.G$1048576]; MATCH([.A13]&[.J13]; [$Appointments.$B$1:$Appointments.$B$1048576]&[$Appointments.$F$1:$Appointments.$F$1048576]; 0)); "")) -> TEST | L13: of:=IFNA(INDEX([$Doc.$B$1:$Doc.$B$1048576]; MATCH(INDEX([$Appointments.$D$1:$Appointments.$D$1048576]; MATCH([.$A13]&[.$J13]; [$Appointments.$B$1:$Appointments.$B$1048576]&[$Appointments.$F$1:$Appointments.$F$1048576]; 0)); [$Doc.$A$1:$Doc.$A$1048576]; 0)); "") -> 
D14: of:=IF(ISBLANK([.C14]); ""; ORG.OPENOFFICE.YEARS([.$C14];TODAY();0)) ->  | E14: m | F14: no | J14: of:=IF(IFNA(COM.MICROSOFT.MAXIFS([$Appointments.$F$1:$Appointments.$F$1048576];[$Appointments.$B$1:$Appointments.$B$1048576];[.A14]); "")=0; ""; IFNA(COM.MICROSOFT.MAXIFS([$Appointments.$F$1:$Appointments.$F$1048576];[$Appointments.$B$1:$Appointments.$B$1048576];[.A14]); "")) ->  | K14: of:=IF(IFNA(INDEX([$Appointments.G$1:$Appointments.G$1048576]; MATCH([.A14]&[.J14]; [$Appointments.$B$1:$Appointments.$B$1048576]&[$Appointments.$F$1:$Appointments.$F$1048576]; 0)); "")=0; ""; IFNA(INDEX([$Appointments.G$1:$Appointments.G$1048576]; MATCH([.A14]&[.J14]; [$Appointments.$B$1:$Appointments.$B$1048576]&[$Appointments.$F$1:$Appointments.$F$1048576]; 0)); "")) ->  | L14: of:=IFNA(INDEX([$Doc.$B$1:$Doc.$B$1048576]; MATCH(INDEX([$Appointments.$D$1:$Appointments.$D$1048576]; MATCH([.$A14]&[.$J14]; [$Appointments.$B$1:$Appointments.$B$1048576]&[$Appointments.$F$1:$Appointments.$F$1048576]; 0)); [$Doc.$A$1:$Doc.$A$1048576]; 0)); "") -> 
D15: of:=IF(ISBLANK([.C15]); ""; ORG.OPENOFFICE.YEARS([.$C15];TODAY();0)) ->  | E15: f | F15: yes | J15: of:=IF(IFNA(COM.MICROSOFT.MAXIFS([$Appointments.$F$1:$Appointments.$F$1048576];[$Appointments.$B$1:$Appointments.$B$1048576];[.A15]); "")=0; ""; IFNA(COM.MICROSOFT.MAXIFS([$Appointments.$F$1:$Appointments.$F$1048576];[$Appointments.$B$1:$Appointments.$B$1048576];[.A15]); "")) ->  | K15: of:=IF(IFNA(INDEX([$Appointments.G$1:$Appointments.G$1048576]; MATCH([.A15]&[.J15]; [$Appointments.$B$1:$Appointments.$B$1048576]&[$Appointments.$F$1:$Appointments.$F$1048576]; 0)); "")=0; ""; IFNA(INDEX([$Appointments.G$1:$Appointments.G$1048576]; MATCH([.A15]&[.J15]; [$Appointments.$B$1:$Appointments.$B$1048576]&[$Appointments.$F$1:$Appointments.$F$1048576]; 0)); "")) ->  | L15: of:=IFNA(INDEX([$Doc.$B$1:$Doc.$B$1048576]; MATCH(INDEX([$Appointments.$D$1:$Appointments.$D$1048576]; MATCH([.$A15]&[.$J15]; [$Appointments.$B$1:$Appointments.$B$1048576]&[$Appointments.$F$1:$Appointments.$F$1048576]; 0)); [$Doc.$A$1:$Doc.$A$1048576]; 0)); "") -> 
D16: of:=IF(ISBLANK([.C16]); ""; ORG.OPENOFFICE.YEARS([.$C16];TODAY();0)) ->  | E16: o | F16: no | J16: of:=IF(IFNA(COM.MICROSOFT.MAXIFS([$Appointments.$F$1:$Appointments.$F$1048576];[$Appointments.$B$1:$Appointments.$B$1048576];[.A16]); "")=0; ""; IFNA(COM.MICROSOFT.MAXIFS([$Appointments.$F$1:$Appointments.$F$1048576];[$Appointments.$B$1:$Appointments.$B$1048576];[.A16]); "")) ->  | K16: of:=IF(IFNA(INDEX([$Appointments.G$1:$Appointments.G$1048576]; MATCH([.A16]&[.J16]; [$Appointments.$B$1:$Appointments.$B$1048576]&[$Appointments.$F$1:$Appointments.$F$1048576]; 0)); "")=0; ""; IFNA(INDEX([$Appointments.G$1:$Appointments.G$1048576]; MATCH([.A16]&[.J16]; [$Appointments.$B$1:$Appointments.$B$1048576]&[$Appointments.$F$1:$Appointments.$F$1048576]; 0)); "")) ->  | L16: of:=IFNA(INDEX([$Doc.$B$1:$Doc.$B$1048576]; MATCH(INDEX([$Appointments.$D$1:$Appointments.$D$1048576]; MATCH([.$A16]&[.$J16]; [$Appointments.$B$1:$Appointments.$B$1048576]&[$Appointments.$F$1:$Appointments.$F$1048576]; 0)); [$Doc.$A$1:$Doc.$A$1048576]; 0)); "") -> 
D17: of:=IF(ISBLANK([.C17]); ""; ORG.OPENOFFICE.YEARS([.$C17];TODAY();0)) ->  | E17: f | F17: yes | J17: of:=IF(IFNA(COM.MICROSOFT.MAXIFS([$Appointments.$F$1:$Appointments.$F$1048576];[$Appointments.$B$1:$Appointments.$B$1048576];[.A17]); "")=0; ""; IFNA(COM.MICROSOFT.MAXIFS([$Appointments.$F$1:$Appointments.$F$1048576];[$Appointments.$B$1:$Appointments.$B$1048576];[.A17]); "")) ->  | K17: of:=IF(IFNA(INDEX([$Appointments.G$1:$Appointments.G$1048576]; MATCH([.A17]&[.J17]; [$Appointments.$B$1:$Appointments.$B$1048576]&[$Appointments.$F$1:$Appointments.$F$1048576]; 0)); "")=0; ""; IFNA(INDEX([$Appointments.G$1:$Appointments.G$1048576]; MATCH([.A17]&[.J17]; [$Appointments.$B$1:$Appointments.$B$1048576]&[$Appointments.$F$1:$Appointments.$F$1048576]; 0)); "")) ->  | L17: of:=IFNA(INDEX([$Doc.$B$1:$Doc.$B$1048576]; MATCH(INDEX([$Appointments.$D$1:$Appointments.$D$1048576]; MATCH([.$A17]&[.$J17]; [$Appointments.$B$1:$Appointments.$B$1048576]&[$Appointments.$F$1:$Appointments.$F$1048576]; 0)); [$Doc.$A$1:$Doc.$A$1048576]; 0)); "") -> 
D18: of:=IF(ISBLANK([.C18]); ""; ORG.OPENOFFICE.YEARS([.$C18];TODAY();0)) ->  | E18: m | F18: no | J18: of:=IF(IFNA(COM.MICROSOFT.MAXIFS([$Appointments.$F$1:$Appointments.$F$1048576];[$Appointments.$B$1:$Appointments.$B$1048576];[.A18]); "")=0; ""; IFNA(COM.MICROSOFT.MAXIFS([$Appointments.$F$1:$Appointments.$F$1048576];[$Appointments.$B$1:$Appointments.$B$1048576];[.A18]); "")) ->  | K18: of:=IF(IFNA(INDEX([$Appointments.G$1:$Appointments.G$1048576]; MATCH([.A18]&[.J18]; [$Appointments.$B$1:$Appointments.$B$1048576]&[$Appointments.$F$1:$Appointments.$F$1048576]; 0)); "")=0; ""; IFNA(INDEX([$Appointments.G$1:$Appointments.G$1048576]; MATCH([.A18]&[.J18]; [$Appointments.$B$1:$Appointments.$B$1048576]&[$Appointments.$F$1:$Appointments.$F$1048576]; 0)); "")) ->  | L18: of:=IFNA(INDEX([$Doc.$B$1:$Doc.$B$1048576]; MATCH(INDEX([$Appointments.$D$1:$Appointments.$D$1048576]; MATCH([.$A18]&[.$J18]; [$Appointments.$B$1:$Appointments.$B$1048576]&[$Appointments.$F$1:$Appointments.$F$1048576]; 0)); [$Doc.$A$1:$Doc.$A$1048576]; 0)); "") -> 
D19: of:=IF(ISBLANK([.C19]); ""; ORG.OPENOFFICE.YEARS([.$C19];TODAY();0)) ->  | E19: f | F19: yes | J19: of:=IF(IFNA(COM.MICROSOFT.MAXIFS([$Appointments.$F$1:$Appointments.$F$1048576];[$Appointments.$B$1:$Appointments.$B$1048576];[.A19]); "")=0; ""; IFNA(COM.MICROSOFT.MAXIFS([$Appointments.$F$1:$Appointments.$F$1048576];[$Appointments.$B$1:$Appointments.$B$1048576];[.A19]); "")) ->  | K19: of:=IF(IFNA(INDEX([$Appointments.G$1:$Appointments.G$1048576]; MATCH([.A19]&[.J19]; [$Appointments.$B$1:$Appointments.$B$1048576]&[$Appointments.$F$1:$Appointments.$F$1048576]; 0)); "")=0; ""; IFNA(INDEX([$Appointments.G$1:$Appointments.G$1048576]; MATCH([.A19]&[.J19]; [$Appointments.$B$1:$Appointments.$B$1048576]&[$Appointments.$F$1:$Appointments.$F$1048576]; 0)); "")) ->  | L19: of:=IFNA(INDEX([$Doc.$B$1:$Doc.$B$1048576]; MATCH(INDEX([$Appointments.$D$1:$Appointments.$D$1048576]; MATCH([.$A19]&[.$J19]; [$Appointments.$B$1:$Appointments.$B$1048576]&[$Appointments.$F$1:$Appointments.$F$1048576]; 0)); [$Doc.$A$1:$Doc.$A$1048576]; 0)); "") -> 
D20: of:=IF(ISBLANK([.C20]); ""; ORG.OPENOFFICE.YEARS([.$C20];TODAY();0)) ->  | E20: m | F20: no | J20: of:=IF(IFNA(COM.MICROSOFT.MAXIFS([$Appointments.$F$1:$Appointments.$F$1048576];[$Appointments.$B$1:$Appointments.$B$1048576];[.A20]); "")=0; ""; IFNA(COM.MICROSOFT.MAXIFS([$Appointments.$F$1:$Appointments.$F$1048576];[$Appointments.$B$1:$Appointments.$B$1048576];[.A20]); "")) ->  | K20: of:=IF(IFNA(INDEX([$Appointments.G$1:$Appointments.G$1048576]; MATCH([.A20]&[.J20]; [$Appointments.$B$1:$Appointments.$B$1048576]&[$Appointments.$F$1:$Appointments.$F$1048576]; 0)); "")=0; ""; IFNA(INDEX([$Appointments.G$1:$Appointments.G$1048576]; MATCH([.A20]&[.J20]; [$Appointments.$B$1:$Appointments.$B$1048576]&[$Appointments.$F$1:$Appointments.$F$1048576]; 0)); "")) ->  | L20: of:=IFNA(INDEX([$Doc.$B$1:$Doc.$B$1048576]; MATCH(INDEX([$Appointments.$D$1:$Appointments.$D$1048576]; MATCH([.$A20]&[.$J20]; [$Appointments.$B$1:$Appointments.$B$1048576]&[$Appointments.$F$1:$Appointments.$F$1048576]; 0)); [$Doc.$A$1:$Doc.$A$1048576]; 0)); "") -> 
D21: of:=IF(ISBLANK([.C21]); ""; ORG.OPENOFFICE.YEARS([.$C21];TODAY();0)) ->  | E21: f | F21: yes | J21: of:=IF(IFNA(COM.MICROSOFT.MAXIFS([$Appointments.$F$1:$Appointments.$F$1048576];[$Appointments.$B$1:$Appointments.$B$1048576];[.A21]); "")=0; ""; IFNA(COM.MICROSOFT.MAXIFS([$Appointments.$F$1:$Appointments.$F$1048576];[$Appointments.$B$1:$Appointments.$B$1048576];[.A21]); "")) ->  | K21: of:=IF(IFNA(INDEX([$Appointments.G$1:$Appointments.G$1048576]; MATCH([.A21]&[.J21]; [$Appointments.$B$1:$Appointments.$B$1048576]&[$Appointments.$F$1:$Appointments.$F$1048576]; 0)); "")=0; ""; IFNA(INDEX([$Appointments.G$1:$Appointments.G$1048576]; MATCH([.A21]&[.J21]; [$Appointments.$B$1:$Appointments.$B$1048576]&[$Appointments.$F$1:$Appointments.$F$1048576]; 0)); "")) ->  | L21: of:=IFNA(INDEX([$Doc.$B$1:$Doc.$B$1048576]; MATCH(INDEX([$Appointments.$D$1:$Appointments.$D$1048576]; MATCH([.$A21]&[.$J21]; [$Appointments.$B$1:$Appointments.$B$1048576]&[$Appointments.$F$1:$Appointments.$F$1048576]; 0)); [$Doc.$A$1:$Doc.$A$1048576]; 0)); "") -> 
D22: of:=IF(ISBLANK([.C22]); ""; ORG.OPENOFFICE.YEARS([.$C22];TODAY();0)) ->  | E22: o | F22: no | J22: of:=IF(IFNA(COM.MICROSOFT.MAXIFS([$Appointments.$F$1:$Appointments.$F$1048576];[$Appointments.$B$1:$Appointments.$B$1048576];[.A22]); "")=0; ""; IFNA(COM.MICROSOFT.MAXIFS([$Appointments.$F$1:$Appointments.$F$1048576];[$Appointments.$B$1:$Appointments.$B$1048576];[.A22]); "")) ->  | K22: of:=IF(IFNA(INDEX([$Appointments.G$1:$Appointments.G$1048576]; MATCH([.A22]&[.J22]; [$Appointments.$B$1:$Appointments.$B$1048576]&[$Appointments.$F$1:$Appointments.$F$1048576]; 0)); "")=0; ""; IFNA(INDEX([$Appointments.G$1:$Appointments.G$1048576]; MATCH([.A22]&[.J22]; [$Appointments.$B$1:$Appointments.$B$1048576]&[$Appointments.$F$1:$Appointments.$F$1048576]; 0)); "")) ->  | L22: of:=IFNA(INDEX([$Doc.$B$1:$Doc.$B$1048576]; MATCH(INDEX([$Appointments.$D$1:$Appointments.$D$1048576]; MATCH([.$A22]&[.$J22]; [$Appointments.$B$1:$Appointments.$B$1048576]&[$Appointments.$F$1:$Appointments.$F$1048576]; 0)); [$Doc.$A$1:$Doc.$A$1048576]; 0)); "") -> 
D23: of:=IF(ISBLANK([.C23]); ""; ORG.OPENOFFICE.YEARS([.$C23];TODAY();0)) ->  | E23: f | F23: yes | J23: of:=IF(IFNA(COM.MICROSOFT.MAXIFS([$Appointments.$F$1:$Appointments.$F$1048576];[$Appointments.$B$1:$Appointments.$B$1048576];[.A23]); "")=0; ""; IFNA(COM.MICROSOFT.MAXIFS([$Appointments.$F$1:$Appointments.$F$1048576];[$Appointments.$B$1:$Appointments.$B$1048576];[.A23]); "")) ->  | K23: of:=IF(IFNA(INDEX([$Appointments.G$1:$Appointments.G$1048576]; MATCH([.A23]&[.J23]; [$Appointments.$B$1:$Appointments.$B$1048576]&[$Appointments.$F$1:$Appointments.$F$1048576]; 0)); "")=0; ""; IFNA(INDEX([$Appointments.G$1:$Appointments.G$1048576]; MATCH([.A23]&[.J23]; [$Appointments.$B$1:$Appointments.$B$1048576]&[$Appointments.$F$1:$Appointments.$F$1048576]; 0)); "")) ->  | L23: of:=IFNA(INDEX([$Doc.$B$1:$Doc.$B$1048576]; MATCH(INDEX([$Appointments.$D$1:$Appointments.$D$1048576]; MATCH([.$A23]&[.$J23]; [$Appointments.$B$1:$Appointments.$B$1048576]&[$Appointments.$F$1:$Appointments.$F$1048576]; 0)); [$Doc.$A$1:$Doc.$A$1048576]; 0)); "") -> 
D24: of:=IF(ISBLANK([.C24]); ""; ORG.OPENOFFICE.YEARS([.$C24];TODAY();0)) ->  | E24: m | F24: no | J24: of:=IF(IFNA(COM.MICROSOFT.MAXIFS([$Appointments.$F$1:$Appointments.$F$1048576];[$Appointments.$B$1:$Appointments.$B$1048576];[.A24]); "")=0; ""; IFNA(COM.MICROSOFT.MAXIFS([$Appointments.$F$1:$Appointments.$F$1048576];[$Appointments.$B$1:$Appointments.$B$1048576];[.A24]); "")) ->  | K24: of:=IF(IFNA(INDEX([$Appointments.G$1:$Appointments.G$1048576]; MATCH([.A24]&[.J24]; [$Appointments.$B$1:$Appointments.$B$1048576]&[$Appointments.$F$1:$Appointments.$F$1048576]; 0)); "")=0; ""; IFNA(INDEX([$Appointments.G$1:$Appointments.G$1048576]; MATCH([.A24]&[.J24]; [$Appointments.$B$1:$Appointments.$B$1048576]&[$Appointments.$F$1:$Appointments.$F$1048576]; 0)); "")) ->  | L24: of:=IFNA(INDEX([$Doc.$B$1:$Doc.$B$1048576]; MATCH(INDEX([$Appointments.$D$1:$Appointments.$D$1048576]; MATCH([.$A24]&[.$J24]; [$Appointments.$B$1:$Appointments.$B$1048576]&[$Appointments.$F$1:$Appointments.$F$1048576]; 0)); [$Doc.$A$1:$Doc.$A$1048576]; 0)); "") -> 
D25: of:=IF(ISBLANK([.C25]); ""; ORG.OPENOFFICE.YEARS([.$C25];TODAY();0)) ->  | E25: f | F25: no | J25: of:=IF(IFNA(COM.MICROSOFT.MAXIFS([$Appointments.$F$1:$Appointments.$F$1048576];[$Appointments.$B$1:$Appointments.$B$1048576];[.A25]); "")=0; ""; IFNA(COM.MICROSOFT.MAXIFS([$Appointments.$F$1:$Appointments.$F$1048576];[$Appointments.$B$1:$Appointments.$B$1048576];[.A25]); "")) ->  | K25: of:=IF(IFNA(INDEX([$Appointments.G$1:$Appointments.G$1048576]; MATCH([.A25]&[.J25]; [$Appointments.$B$1:$Appointments.$B$1048576]&[$Appointments.$F$1:$Appointments.$F$1048576]; 0)); "")=0; ""; IFNA(INDEX([$Appointments.G$1:$Appointments.G$1048576]; MATCH([.A25]&[.J25]; [$Appointments.$B$1:$Appointments.$B$1048576]&[$Appointments.$F$1:$Appointments.$F$1048576]; 0)); "")) ->  | L25: of:=IFNA(INDEX([$Doc.$B$1:$Doc.$B$1048576]; MATCH(INDEX([$Appointments.$D$1:$Appointments.$D$1048576]; MATCH([.$A25]&[.$J25]; [$Appointments.$B$1:$Appointments.$B$1048576]&[$Appointments.$F$1:$Appointments.$F$1048576]; 0)); [$Doc.$A$1:$Doc.$A$1048576]; 0)); "") -> 
D26: of:=IF(ISBLANK([.C26]); ""; ORG.OPENOFFICE.YEARS([.$C26];TODAY();0)) ->  | E26: m | F26: no | J26: of:=IF(IFNA(COM.MICROSOFT.MAXIFS([$Appointments.$F$1:$Appointments.$F$1048576];[$Appointments.$B$1:$Appointments.$B$1048576];[.A26]); "")=0; ""; IFNA(COM.MICROSOFT.MAXIFS([$Appointments.$F$1:$Appointments.$F$1048576];[$Appointments.$B$1:$Appointments.$B$1048576];[.A26]); "")) ->  | K26: of:=IF(IFNA(INDEX([$Appointments.G$1:$Appointments.G$1048576]; MATCH([.A26]&[.J26]; [$Appointments.$B$1:$Appointments.$B$1048576]&[$Appointments.$F$1:$Appointments.$F$1048576]; 0)); "")=0; ""; IFNA(INDEX([$Appointments.G$1:$Appointments.G$1048576]; MATCH([.A26]&[.J26]; [$Appointments.$B$1:$Appointments.$B$1048576]&[$Appointments.$F$1:$Appointments.$F$1048576]; 0)); "")) ->  | L26: of:=IFNA(INDEX([$Doc.$B$1:$Doc.$B$1048576]; MATCH(INDEX([$Appointments.$D$1:$Appointments.$D$1048576]; MATCH([.$A26]&[.$J26]; [$Appointments.$B$1:$Appointments.$B$1048576]&[$Appointments.$F$1:$Appointments.$F$1048576]; 0)); [$Doc.$A$1:$Doc.$A$1048576]; 0)); "") -> 
D27: of:=IF(ISBLANK([.C27]); ""; ORG.OPENOFFICE.YEARS([.$C27];TODAY();0)) ->  | E27: f | F27: no | J27: of:=IF(IFNA(COM.MICROSOFT.MAXIFS([$Appointments.$F$1:$Appointments.$F$1048576];[$Appointments.$B$1:$Appointments.$B$1048576];[.A27]); "")=0; ""; IFNA(COM.MICROSOFT.MAXIFS([$Appointments.$F$1:$Appointments.$F$1048576];[$Appointments.$B$1:$Appointments.$B$1048576];[.A27]); "")) ->  | K27: of:=IF(IFNA(INDEX([$Appointments.G$1:$Appointments.G$1048576]; MATCH([.A27]&[.J27]; [$Appointments.$B$1:$Appointments.$B$1048576]&[$Appointments.$F$1:$Appointments.$F$1048576]; 0)); "")=0; ""; IFNA(INDEX([$Appointments.G$1:$Appointments.G$1048576]; MATCH([.A27]&[.J27]; [$Appointments.$B$1:$Appointments.$B$1048576]&[$Appointments.$F$1:$Appointments.$F$1048576]; 0)); "")) ->  | L27: of:=IFNA(INDEX([$Doc.$B$1:$Doc.$B$1048576]; MATCH(INDEX([$Appointments.$D$1:$Appointments.$D$1048576]; MATCH([.$A27]&[.$J27]; [$Appointments.$B$1:$Appointments.$B$1048576]&[$Appointments.$F$1:$Appointments.$F$1048576]; 0)); [$Doc.$A$1:$Doc.$A$1048576]; 0)); "") -> 
D28: of:=IF(ISBLANK([.C28]); ""; ORG.OPENOFFICE.YEARS([.$C28];TODAY();0)) ->  | E28: o | F28: no | J28: of:=IF(IFNA(COM.MICROSOFT.MAXIFS([$Appointments.$F$1:$Appointments.$F$1048576];[$Appointments.$B$1:$Appointments.$B$1048576];[.A28]); "")=0; ""; IFNA(COM.MICROSOFT.MAXIFS([$Appointments.$F$1:$Appointments.$F$1048576];[$Appointments.$B$1:$Appointments.$B$1048576];[.A28]); "")) ->  | K28: of:=IF(IFNA(INDEX([$Appointments.G$1:$Appointments.G$1048576]; MATCH([.A28]&[.J28]; [$Appointments.$B$1:$Appointments.$B$1048576]&[$Appointments.$F$1:$Appointments.$F$1048576]; 0)); "")=0; ""; IFNA(INDEX([$Appointments.G$1:$Appointments.G$1048576]; MATCH([.A28]&[.J28]; [$Appointments.$B$1:$Appointments.$B$1048576]&[$Appointments.$F$1:$Appointments.$F$1048576]; 0)); "")) ->  | L28: of:=IFNA(INDEX([$Doc.$B$1:$Doc.$B$1048576]; MATCH(INDEX([$Appointments.$D$1:$Appointments.$D$1048576]; MATCH([.$A28]&[.$J28]; [$Appointments.$B$1:$Appointments.$B$1048576]&[$Appointments.$F$1:$Appointments.$F$1048576]; 0)); [$Doc.$A$1:$Doc.$A$1048576]; 0)); "") -> 
D29: of:=IF(ISBLANK([.C29]); ""; ORG.OPENOFFICE.YEARS([.$C29];TODAY();0)) ->  | E29: f | F29: no | J29: of:=IF(IFNA(COM.MICROSOFT.MAXIFS([$Appointments.$F$1:$Appointments.$F$1048576];[$Appointments.$B$1:$Appointments.$B$1048576];[.A29]); "")=0; ""; IFNA(COM.MICROSOFT.MAXIFS([$Appointments.$F$1:$Appointments.$F$1048576];[$Appointments.$B$1:$Appointments.$B$1048576];[.A29]); "")) ->  | K29: of:=IF(IFNA(INDEX([$Appointments.G$1:$Appointments.G$1048576]; MATCH([.A29]&[.J29]; [$Appointments.$B$1:$Appointments.$B$1048576]&[$Appointments.$F$1:$Appointments.$F$1048576]; 0)); "")=0; ""; IFNA(INDEX([$Appointments.G$1:$Appointments.G$1048576]; MATCH([.A29]&[.J29]; [$Appointments.$B$1:$Appointments.$B$1048576]&[$Appointments.$F$1:$Appointments.$F$1048576]; 0)); "")) ->  | L29: of:=IFNA(INDEX([$Doc.$B$1:$Doc.$B$1048576]; MATCH(INDEX([$Appointments.$D$1:$Appointments.$D$1048576]; MATCH([.$A29]&[.$J29]; [$Appointments.$B$1:$Appointments.$B$1048576]&[$Appointments.$F$1:$Appointments.$F$1048576]; 0)); [$Doc.$A$1:$Doc.$A$1048576]; 0)); "") -> 
D30: of:=IF(ISBLANK([.C30]); ""; ORG.OPENOFFICE.YEARS([.$C30];TODAY();0)) ->  | F30: no | J30: of:=IF(IFNA(COM.MICROSOFT.MAXIFS([$Appointments.$F$1:$Appointments.$F$1048576];[$Appointments.$B$1:$Appointments.$B$1048576];[.A30]); "")=0; ""; IFNA(COM.MICROSOFT.MAXIFS([$Appointments.$F$1:$Appointments.$F$1048576];[$Appointments.$B$1:$Appointments.$B$1048576];[.A30]); "")) ->  | K30: of:=IF(IFNA(INDEX([$Appointments.G$1:$Appointments.G$1048576]; MATCH([.A30]&[.J30]; [$Appointments.$B$1:$Appointments.$B$1048576]&[$Appointments.$F$1:$Appointments.$F$1048576]; 0)); "")=0; ""; IFNA(INDEX([$Appointments.G$1:$Appointments.G$1048576]; MATCH([.A30]&[.J30]; [$Appointments.$B$1:$Appointments.$B$1048576]&[$Appointments.$F$1:$Appointments.$F$1048576]; 0)); "")) ->  | L30: of:=IFNA(INDEX([$Doc.$B$1:$Doc.$B$1048576]; MATCH(INDEX([$Appointments.$D$1:$Appointments.$D$1048576]; MATCH([.$A30]&[.$J30]; [$Appointments.$B$1:$Appointments.$B$1048576]&[$Appointments.$F$1:$Appointments.$F$1048576]; 0)); [$Doc.$A$1:$Doc.$A$1048576]; 0)); "") -> 
D31: of:=IF(ISBLANK([.C31]); ""; ORG.OPENOFFICE.YEARS([.$C31];TODAY();0)) ->  | F31: no | J31: of:=IF(IFNA(COM.MICROSOFT.MAXIFS([$Appointments.$F$1:$Appointments.$F$1048576];[$Appointments.$B$1:$Appointments.$B$1048576];[.A31]); "")=0; ""; IFNA(COM.MICROSOFT.MAXIFS([$Appointments.$F$1:$Appointments.$F$1048576];[$Appointments.$B$1:$Appointments.$B$1048576];[.A31]); "")) ->  | K31: of:=IF(IFNA(INDEX([$Appointments.G$1:$Appointments.G$1048576]; MATCH([.A31]&[.J31]; [$Appointments.$B$1:$Appointments.$B$1048576]&[$Appointments.$F$1:$Appointments.$F$1048576]; 0)); "")=0; ""; IFNA(INDEX([$Appointments.G$1:$Appointments.G$1048576]; MATCH([.A31]&[.J31]; [$Appointments.$B$1:$Appointments.$B$1048576]&[$Appointments.$F$1:$Appointments.$F$1048576]; 0)); "")) ->  | L31: of:=IFNA(INDEX([$Doc.$B$1:$Doc.$B$1048576]; MATCH(INDEX([$Appointments.$D$1:$Appointments.$D$1048576]; MATCH([.$A31]&[.$J31]; [$Appointments.$B$1:$Appointments.$B$1048576]&[$Appointments.$F$1:$Appointments.$F$1048576]; 0)); [$Doc.$A$1:$Doc.$A$1048576]; 0)); "") -> 
D32: of:=IF(ISBLANK([.C32]); ""; ORG.OPENOFFICE.YEARS([.$C32];TODAY();0)) ->  | F32: no | J32: of:=IF(IFNA(COM.MICROSOFT.MAXIFS([$Appointments.$F$1:$Appointments.$F$1048576];[$Appointments.$B$1:$Appointments.$B$1048576];[.A32]); "")=0; ""; IFNA(COM.MICROSOFT.MAXIFS([$Appointments.$F$1:$Appointments.$F$1048576];[$Appointments.$B$1:$Appointments.$B$1048576];[.A32]); "")) ->  | K32: of:=IF(IFNA(INDEX([$Appointments.G$1:$Appointments.G$1048576]; MATCH([.A32]&[.J32]; [$Appointments.$B$1:$Appointments.$B$1048576]&[$Appointments.$F$1:$Appointments.$F$1048576]; 0)); "")=0; ""; IFNA(INDEX([$Appointments.G$1:$Appointments.G$1048576]; MATCH([.A32]&[.J32]; [$Appointments.$B$1:$Appointments.$B$1048576]&[$Appointments.$F$1:$Appointments.$F$1048576]; 0)); "")) ->  | L32: of:=IFNA(INDEX([$Doc.$B$1:$Doc.$B$1048576]; MATCH(INDEX([$Appointments.$D$1:$Appointments.$D$1048576]; MATCH([.$A32]&[.$J32]; [$Appointments.$B$1:$Appointments.$B$1048576]&[$Appointments.$F$1:$Appointments.$F$1048576]; 0)); [$Doc.$A$1:$Doc.$A$1048576]; 0)); "") -> 
D33: of:=IF(ISBLANK([.C33]); ""; ORG.OPENOFFICE.YEARS([.$C33];TODAY();0)) ->  | F33: no | J33: of:=IF(IFNA(COM.MICROSOFT.MAXIFS([$Appointments.$F$1:$Appointments.$F$1048576];[$Appointments.$B$1:$Appointments.$B$1048576];[.A33]); "")=0; ""; IFNA(COM.MICROSOFT.MAXIFS([$Appointments.$F$1:$Appointments.$F$1048576];[$Appointments.$B$1:$Appointments.$B$1048576];[.A33]); "")) ->  | K33: of:=IF(IFNA(INDEX([$Appointments.G$1:$Appointments.G$1048576]; MATCH([.A33]&[.J33]; [$Appointments.$B$1:$Appointments.$B$1048576]&[$Appointments.$F$1:$Appointments.$F$1048576]; 0)); "")=0; ""; IFNA(INDEX([$Appointments.G$1:$Appointments.G$1048576]; MATCH([.A33]&[.J33]; [$Appointments.$B$1:$Appointments.$B$1048576]&[$Appointments.$F$1:$Appointments.$F$1048576]; 0)); "")) ->  | L33: of:=IFNA(INDEX([$Doc.$B$1:$Doc.$B$1048576]; MATCH(INDEX([$Appointments.$D$1:$Appointments.$D$1048576]; MATCH([.$A33]&[.$J33]; [$Appointments.$B$1:$Appointments.$B$1048576]&[$Appointments.$F$1:$Appointments.$F$1048576]; 0)); [$Doc.$A$1:$Doc.$A$1048576]; 0)); "") -> 
D34: of:=IF(ISBLANK([.C34]); ""; ORG.OPENOFFICE.YEARS([.$C34];TODAY();0)) ->  | F34: no | J34: of:=IF(IFNA(COM.MICROSOFT.MAXIFS([$Appointments.$F$1:$Appointments.$F$1048576];[$Appointments.$B$1:$Appointments.$B$1048576];[.A34]); "")=0; ""; IFNA(COM.MICROSOFT.MAXIFS([$Appointments.$F$1:$Appointments.$F$1048576];[$Appointments.$B$1:$Appointments.$B$1048576];[.A34]); "")) ->  | K34: of:=IF(IFNA(INDEX([$Appointments.G$1:$Appointments.G$1048576]; MATCH([.A34]&[.J34]; [$Appointments.$B$1:$Appointments.$B$1048576]&[$Appointments.$F$1:$Appointments.$F$1048576]; 0)); "")=0; ""; IFNA(INDEX([$Appointments.G$1:$Appointments.G$1048576]; MATCH([.A34]&[.J34]; [$Appointments.$B$1:$Appointments.$B$1048576]&[$Appointments.$F$1:$Appointments.$F$1048576]; 0)); "")) ->  | L34: of:=IFNA(INDEX([$Doc.$B$1:$Doc.$B$1048576]; MATCH(INDEX([$Appointments.$D$1:$Appointments.$D$1048576]; MATCH([.$A34]&[.$J34]; [$Appointments.$B$1:$Appointments.$B$1048576]&[$Appointments.$F$1:$Appointments.$F$1048576]; 0)); [$Doc.$A$1:$Doc.$A$1048576]; 0)); "") -> 
D35: of:=IF(ISBLANK([.C35]); ""; ORG.OPENOFFICE.YEARS([.$C35];TODAY();0)) ->  | F35: no | J35: of:=IF(IFNA(COM.MICROSOFT.MAXIFS([$Appointments.$F$1:$Appointments.$F$1048576];[$Appointments.$B$1:$Appointments.$B$1048576];[.A35]); "")=0; ""; IFNA(COM.MICROSOFT.MAXIFS([$Appointments.$F$1:$Appointments.$F$1048576];[$Appointments.$B$1:$Appointments.$B$1048576];[.A35]); "")) ->  | K35: of:=IF(IFNA(INDEX([$Appointments.G$1:$Appointments.G$1048576]; MATCH([.A35]&[.J35]; [$Appointments.$B$1:$Appointments.$B$1048576]&[$Appointments.$F$1:$Appointments.$F$1048576]; 0)); "")=0; ""; IFNA(INDEX([$Appointments.G$1:$Appointments.G$1048576]; MATCH([.A35]&[.J35]; [$Appointments.$B$1:$Appointments.$B$1048576]&[$Appointments.$F$1:$Appointments.$F$1048576]; 0)); "")) -> 
D36: of:=IF(ISBLANK([.C36]); ""; ORG.OPENOFFICE.YEARS([.$C36];TODAY();0)) ->  | J36: of:=IF(IFNA(COM.MICROSOFT.MAXIFS([$Appointments.$F$1:$Appointments.$F$1048576];[$Appointments.$B$1:$Appointments.$B$1048576];[.A36]); "")=0; ""; IFNA(COM.MICROSOFT.MAXIFS([$Appointments.$F$1:$Appointments.$F$1048576];[$Appointments.$B$1:$Appointments.$B$1048576];[.A36]); "")) ->  | K36: of:=IF(IFNA(INDEX([$Appointments.G$1:$Appointments.G$1048576]; MATCH([.A36]&[.J36]; [$Appointments.$B$1:$Appointments.$B$1048576]&[$Appointments.$F$1:$Appointments.$F$1048576]; 0)); "")=0; ""; IFNA(INDEX([$Appointments.G$1:$Appointments.G$1048576]; MATCH([.A36]&[.J36]; [$Appointments.$B$1:$Appointments.$B$1048576]&[$Appointments.$F$1:$Appointments.$F$1048576]; 0)); "")) -> 
D37: of:=IF(ISBLANK([.C37]); ""; ORG.OPENOFFICE.YEARS([.$C37];TODAY();0)) ->  | J37: of:=IF(IFNA(COM.MICROSOFT.MAXIFS([$Appointments.$F$1:$Appointments.$F$1048576];[$Appointments.$B$1:$Appointments.$B$1048576];[.A37]); "")=0; ""; IFNA(COM.MICROSOFT.MAXIFS([$Appointments.$F$1:$Appointments.$F$1048576];[$Appointments.$B$1:$Appointments.$B$1048576];[.A37]); "")) ->  | K37: of:=IF(IFNA(INDEX([$Appointments.G$1:$Appointments.G$1048576]; MATCH([.A37]&[.J37]; [$Appointments.$B$1:$Appointments.$B$1048576]&[$Appointments.$F$1:$Appointments.$F$1048576]; 0)); "")=0; ""; IFNA(INDEX([$Appointments.G$1:$Appointments.G$1048576]; MATCH([.A37]&[.J37]; [$Appointments.$B$1:$Appointments.$B$1048576]&[$Appointments.$F$1:$Appointments.$F$1048576]; 0)); "")) -> 
D38: of:=IF(ISBLANK([.C38]); ""; ORG.OPENOFFICE.YEARS([.$C38];TODAY();0)) ->  | J38: of:=IF(IFNA(COM.MICROSOFT.MAXIFS([$Appointments.$F$1:$Appointments.$F$1048576];[$Appointments.$B$1:$Appointments.$B$1048576];[.A38]); "")=0; ""; IFNA(COM.MICROSOFT.MAXIFS([$Appointments.$F$1:$Appointments.$F$1048576];[$Appointments.$B$1:$Appointments.$B$1048576];[.A38]); "")) ->  | K38: of:=IF(IFNA(INDEX([$Appointments.G$1:$Appointments.G$1048576]; MATCH([.A38]&[.J38]; [$Appointments.$B$1:$Appointments.$B$1048576]&[$Appointments.$F$1:$Appointments.$F$1048576]; 0)); "")=0; ""; IFNA(INDEX([$Appointments.G$1:$Appointments.G$1048576]; MATCH([.A38]&[.J38]; [$Appointments.$B$1:$Appointments.$B$1048576]&[$Appointments.$F$1:$Appointments.$F$1048576]; 0)); "")) -> 
D39: of:=IF(ISBLANK([.C39]); ""; ORG.OPENOFFICE.YEARS([.$C39];TODAY();0)) ->  | J39: of:=IF(IFNA(COM.MICROSOFT.MAXIFS([$Appointments.$F$1:$Appointments.$F$1048576];[$Appointments.$B$1:$Appointments.$B$1048576];[.A39]); "")=0; ""; IFNA(COM.MICROSOFT.MAXIFS([$Appointments.$F$1:$Appointments.$F$1048576];[$Appointments.$B$1:$Appointments.$B$1048576];[.A39]); "")) ->  | K39: of:=IF(IFNA(INDEX([$Appointments.G$1:$Appointments.G$1048576]; MATCH([.A39]&[.J39]; [$Appointments.$B$1:$Appointments.$B$1048576]&[$Appointments.$F$1:$Appointments.$F$1048576]; 0)); "")=0; ""; IFNA(INDEX([$Appointments.G$1:$Appointments.G$1048576]; MATCH([.A39]&[.J39]; [$Appointments.$B$1:$Appointments.$B$1048576]&[$Appointments.$F$1:$Appointments.$F$1048576]; 0)); "")) -> 
D40: of:=IF(ISBLANK([.C40]); ""; ORG.OPENOFFICE.YEARS([.$C40];TODAY();0)) ->  | K40: of:=IF(IFNA(INDEX([$Appointments.G$1:$Appointments.G$1048576]; MATCH([.A40]&[.J40]; [$Appointments.$B$1:$Appointments.$B$1048576]&[$Appointments.$F$1:$Appointments.$F$1048576]; 0)); "")=0; ""; IFNA(INDEX([$Appointments.G$1:$Appointments.G$1048576]; MATCH([.A40]&[.J40]; [$Appointments.$B$1:$Appointments.$B$1048576]&[$Appointments.$F$1:$Appointments.$F$1048576]; 0)); "")) -> 
D41: of:=IF(ISBLANK([.C41]); ""; ORG.OPENOFFICE.YEARS([.$C41];TODAY();0)) ->  | K41: of:=IF(IFNA(INDEX([$Appointments.G$1:$Appointments.G$1048576]; MATCH([.A41]&[.J41]; [$Appointments.$B$1:$Appointments.$B$1048576]&[$Appointments.$F$1:$Appointments.$F$1048576]; 0)); "")=0; ""; IFNA(INDEX([$Appointments.G$1:$Appointments.G$1048576]; MATCH([.A41]&[.J41]; [$Appointments.$B$1:$Appointments.$B$1048576]&[$Appointments.$F$1:$Appointments.$F$1048576]; 0)); "")) -> 
D42: of:=IF(ISBLANK([.C42]); ""; ORG.OPENOFFICE.YEARS([.$C42];TODAY();0)) ->  | K42: of:=IF(IFNA(INDEX([$Appointments.G$1:$Appointments.G$1048576]; MATCH([.A42]&[.J42]; [$Appointments.$B$1:$Appointments.$B$1048576]&[$Appointments.$F$1:$Appointments.$F$1048576]; 0)); "")=0; ""; IFNA(INDEX([$Appointments.G$1:$Appointments.G$1048576]; MATCH([.A42]&[.J42]; [$Appointments.$B$1:$Appointments.$B$1048576]&[$Appointments.$F$1:$Appointments.$F$1048576]; 0)); "")) -> 
D43: of:=IF(ISBLANK([.C43]); ""; ORG.OPENOFFICE.YEARS([.$C43];TODAY();0)) ->  | K43: of:=IF(IFNA(INDEX([$Appointments.G$1:$Appointments.G$1048576]; MATCH([.A43]&[.J43]; [$Appointments.$B$1:$Appointments.$B$1048576]&[$Appointments.$F$1:$Appointments.$F$1048576]; 0)); "")=0; ""; IFNA(INDEX([$Appointments.G$1:$Appointments.G$1048576]; MATCH([.A43]&[.J43]; [$Appointments.$B$1:$Appointments.$B$1048576]&[$Appointments.$F$1:$Appointments.$F$1048576]; 0)); "")) -> 
D44: of:=IF(ISBLANK([.C44]); ""; ORG.OPENOFFICE.YEARS([.$C44];TODAY();0)) ->  | K44: of:=IF(IFNA(INDEX([$Appointments.G$1:$Appointments.G$1048576]; MATCH([.A44]&[.J44]; [$Appointments.$B$1:$Appointments.$B$1048576]&[$Appointments.$F$1:$Appointments.$F$1048576]; 0)); "")=0; ""; IFNA(INDEX([$Appointments.G$1:$Appointments.G$1048576]; MATCH([.A44]&[.J44]; [$Appointments.$B$1:$Appointments.$B$1048576]&[$Appointments.$F$1:$Appointments.$F$1048576]; 0)); "")) -> 
D45: of:=IF(ISBLANK([.C45]); ""; ORG.OPENOFFICE.YEARS([.$C45];TODAY();0)) -> 
D46: of:=IF(ISBLANK([.C46]); ""; ORG.OPENOFFICE.YEARS([.$C46];TODAY();0)) -> 
D47: of:=IF(ISBLANK([.C47]); ""; ORG.OPENOFFICE.YEARS([.$C47];TODAY();0)) -> 
D48: of:=IF(ISBLANK([.C48]); ""; ORG.OPENOFFICE.YEARS([.$C48];TODAY();0)) -> 
D49: of:=IF(ISBLANK([.C49]); ""; ORG.OPENOFFICE.YEARS([.$C49];TODAY();0)) -> 
D50: of:=IF(ISBLANK([.C50]); ""; ORG.OPENOFFICE.YEARS([.$C50];TODAY();0)) -> 
D51: of:=IF(ISBLANK([.C51]); ""; ORG.OPENOFFICE.YEARS([.$C51];TODAY();0)) -> 
D52: of:=IF(ISBLANK([.C52]); ""; ORG.OPENOFFICE.YEARS([.$C52];TODAY();0)) -> 
D53: of:=IF(ISBLANK([.C53]); ""; ORG.OPENOFFICE.YEARS([.$C53];TODAY();0)) -> 
D54: of:=IF(ISBLANK([.C54]); ""; ORG.OPENOFFICE.YEARS([.$C54];TODAY();0)) -> 
D55: of:=IF(ISBLANK([.C55]); ""; ORG.OPENOFFICE.YEARS([.$C55];TODAY();0)) -> 
D56: of:=IF(ISBLANK([.C56]); ""; ORG.OPENOFFICE.YEARS([.$C56];TODAY();0)) -> 
D57: of:=IF(ISBLANK([.C57]); ""; ORG.OPENOFFICE.YEARS([.$C57];TODAY();0)) -> 
D58: of:=IF(ISBLANK([.C58]); ""; ORG.OPENOFFICE.YEARS([.$C58];TODAY();0)) -> 
D59: of:=IF(ISBLANK([.C59]); ""; ORG.OPENOFFICE.YEARS([.$C59];TODAY();0)) -> 
D60: of:=IF(ISBLANK([.C60]); ""; ORG.OPENOFFICE.YEARS([.$C60];TODAY();0)) -> 
D61: of:=IF(ISBLANK([.C61]); ""; ORG.OPENOFFICE.YEARS([.$C61];TODAY();0)) -> 
D62: of:=IF(ISBLANK([.C62]); ""; ORG.OPENOFFICE.YEARS([.$C62];TODAY();0)) -> 
D63: of:=IF(ISBLANK([.C63]); ""; ORG.OPENOFFICE.YEARS([.$C63];TODAY();0)) -> 
D64: of:=IF(ISBLANK([.C64]); ""; ORG.OPENOFFICE.YEARS([.$C64];TODAY();0)) -> 
D65: of:=IF(ISBLANK([.C65]); ""; ORG.OPENOFFICE.YEARS([.$C65];TODAY();0)) -> 
D66: of:=IF(ISBLANK([.C66]); ""; ORG.OPENOFFICE.YEARS([.$C66];TODAY();0)) -> 
D67: of:=IF(ISBLANK([.C67]); ""; ORG.OPENOFFICE.YEARS([.$C67];TODAY();0)) -> 
D68: of:=IF(ISBLANK([.C68]); ""; ORG.OPENOFFICE.YEARS([.$C68];TODAY();0)) -> 
D69: of:=IF(ISBLANK([.C69]); ""; ORG.OPENOFFICE.YEARS([.$C69];TODAY();0)) -> 
D70: of:=IF(ISBLANK([.C70]); ""; ORG.OPENOFFICE.YEARS([.$C70];TODAY();0)) -> 
D71: of:=IF(ISBLANK([.C71]); ""; ORG.OPENOFFICE.YEARS([.$C71];TODAY();0)) -> 
D72: of:=IF(ISBLANK([.C72]); ""; ORG.OPENOFFICE.YEARS([.$C72];TODAY();0)) -> 
D73: of:=IF(ISBLANK([.C73]); ""; ORG.OPENOFFICE.YEARS([.$C73];TODAY();0)) -> 
D74: of:=IF(ISBLANK([.C74]); ""; ORG.OPENOFFICE.YEARS([.$C74];TODAY();0)) -> 
D75: of:=IF(ISBLANK([.C75]); ""; ORG.OPENOFFICE.YEARS([.$C75];TODAY();0)) -> 
D76: of:=IF(ISBLANK([.C76]); ""; ORG.OPENOFFICE.YEARS([.$C76];TODAY();0)) -> 
D77: of:=IF(ISBLANK([.C77]); ""; ORG.OPENOFFICE.YEARS([.$C77];TODAY();0)) -> 
D78: of:=IF(ISBLANK([.C78]); ""; ORG.OPENOFFICE.YEARS([.$C78];TODAY();0)) -> 
D79: of:=IF(ISBLANK([.C79]); ""; ORG.OPENOFFICE.YEARS([.$C79];TODAY();0)) -> 
D80: of:=IF(ISBLANK([.C80]); ""; ORG.OPENOFFICE.YEARS([.$C80];TODAY();0)) -> 
D81: of:=IF(ISBLANK([.C81]); ""; ORG.OPENOFFICE.YEARS([.$C81];TODAY();0)) -> 
D82: of:=IF(ISBLANK([.C82]); ""; ORG.OPENOFFICE.YEARS([.$C82];TODAY();0)) -> 
D83: of:=IF(ISBLANK([.C83]); ""; ORG.OPENOFFICE.YEARS([.$C83];TODAY();0)) -> 
D84: of:=IF(ISBLANK([.C84]); ""; ORG.OPENOFFICE.YEARS([.$C84];TODAY();0)) -> 
D85: of:=IF(ISBLANK([.C85]); ""; ORG.OPENOFFICE.YEARS([.$C85];TODAY();0)) -> 
D86: of:=IF(ISBLANK([.C86]); ""; ORG.OPENOFFICE.YEARS([.$C86];TODAY();0)) -> 
D87: of:=IF(ISBLANK([.C87]); ""; ORG.OPENOFFICE.YEARS([.$C87];TODAY();0)) -> 
D88: of:=IF(ISBLANK([.C88]); ""; ORG.OPENOFFICE.YEARS([.$C88];TODAY();0)) -> 
D89: of:=IF(ISBLANK([.C89]); ""; ORG.OPENOFFICE.YEARS([.$C89];TODAY();0)) -> 
D90: of:=IF(ISBLANK([.C90]); ""; ORG.OPENOFFICE.YEARS([.$C90];TODAY();0)) -> 
D91: of:=IF(ISBLANK([.C91]); ""; ORG.OPENOFFICE.YEARS([.$C91];TODAY();0)) -> 
D92: of:=IF(ISBLANK([.C92]); ""; ORG.OPENOFFICE.YEARS([.$C92];TODAY();0)) -> 
D93: of:=IF(ISBLANK([.C93]); ""; ORG.OPENOFFICE.YEARS([.$C93];TODAY();0)) -> 
D94: of:=IF(ISBLANK([.C94]); ""; ORG.OPENOFFICE.YEARS([.$C94];TODAY();0)) -> 
D95: of:=IF(ISBLANK([.C95]); ""; ORG.OPENOFFICE.YEARS([.$C95];TODAY();0)) -> 
D96: of:=IF(ISBLANK([.C96]); ""; ORG.OPENOFFICE.YEARS([.$C96];TODAY();0)) -> 
D97: of:=IF(ISBLANK([.C97]); ""; ORG.OPENOFFICE.YEARS([.$C97];TODAY();0)) -> 
D98: of:=IF(ISBLANK([.C98]); ""; ORG.OPENOFFICE.YEARS([.$C98];TODAY();0)) -> 
D99: of:=IF(ISBLANK([.C99]); ""; ORG.OPENOFFICE.YEARS([.$C99];TODAY();0)) -> 
D100: of:=IF(ISBLANK([.C100]); ""; ORG.OPENOFFICE.YEARS([.$C100];TODAY();0)) -> 
D101: of:=IF(ISBLANK([.C101]); ""; ORG.OPENOFFICE.YEARS([.$C101];TODAY();0)) -> 
D102: of:=IF(ISBLANK([.C102]); ""; ORG.OPENOFFICE.YEARS([.$C102];TODAY();0)) -> 
D103: of:=IF(ISBLANK([.C103]); ""; ORG.OPENOFFICE.YEARS([.$C103];TODAY();0)) -> 
D104: of:=IF(ISBLANK([.C104]); ""; ORG.OPENOFFICE.YEARS([.$C104];TODAY();0)) -> 
D105: of:=IF(ISBLANK([.C105]); ""; ORG.OPENOFFICE.YEARS([.$C105];TODAY();0)) -> 
D106: of:=IF(ISBLANK([.C106]); ""; ORG.OPENOFFICE.YEARS([.$C106];TODAY();0)) -> 
D107: of:=IF(ISBLANK([.C107]); ""; ORG.OPENOFFICE.YEARS([.$C107];TODAY();0)) -> 
D108: of:=IF(ISBLANK([.C108]); ""; ORG.OPENOFFICE.YEARS([.$C108];TODAY();0)) -> 
D109: of:=IF(ISBLANK([.C109]); ""; ORG.OPENOFFICE.YEARS([.$C109];TODAY();0)) -> 
D110: of:=IF(ISBLANK([.C110]); ""; ORG.OPENOFFICE.YEARS([.$C110];TODAY();0)) -> 
D111: of:=IF(ISBLANK([.C111]); ""; ORG.OPENOFFICE.YEARS([.$C111];TODAY();0)) -> 
D112: of:=IF(ISBLANK([.C112]); ""; ORG.OPENOFFICE.YEARS([.$C112];TODAY();0)) -> 
D113: of:=IF(ISBLANK([.C113]); ""; ORG.OPENOFFICE.YEARS([.$C113];TODAY();0)) -> 
D114: of:=IF(ISBLANK([.C114]); ""; ORG.OPENOFFICE.YEARS([.$C114];TODAY();0)) -> 
D115: of:=IF(ISBLANK([.C115]); ""; ORG.OPENOFFICE.YEARS([.$C115];TODAY();0)) -> 
D116: of:=IF(ISBLANK([.C116]); ""; ORG.OPENOFFICE.YEARS([.$C116];TODAY();0)) -> 
D117: of:=IF(ISBLANK([.C117]); ""; ORG.OPENOFFICE.YEARS([.$C117];TODAY();0)) -> 
D118: of:=IF(ISBLANK([.C118]); ""; ORG.OPENOFFICE.YEARS([.$C118];TODAY();0)) -> 
D119: of:=IF(ISBLANK([.C119]); ""; ORG.OPENOFFICE.YEARS([.$C119];TODAY();0)) -> 
D120: of:=IF(ISBLANK([.C120]); ""; ORG.OPENOFFICE.YEARS([.$C120];TODAY();0)) -> 
D121: of:=IF(ISBLANK([.C121]); ""; ORG.OPENOFFICE.YEARS([.$C121];TODAY();0)) -> 
D122: of:=IF(ISBLANK([.C122]); ""; ORG.OPENOFFICE.YEARS([.$C122];TODAY();0)) -> 
D123: of:=IF(ISBLANK([.C123]); ""; ORG.OPENOFFICE.YEARS([.$C123];TODAY();0)) -> 
D124: of:=IF(ISBLANK([.C124]); ""; ORG.OPENOFFICE.YEARS([.$C124];TODAY();0)) -> 
D125: of:=IF(ISBLANK([.C125]); ""; ORG.OPENOFFICE.YEARS([.$C125];TODAY();0)) -> 
D126: of:=IF(ISBLANK([.C126]); ""; ORG.OPENOFFICE.YEARS([.$C126];TODAY();0)) -> 
D127: of:=IF(ISBLANK([.C127]); ""; ORG.OPENOFFICE.YEARS([.$C127];TODAY();0)) -> 
D128: of:=IF(ISBLANK([.C128]); ""; ORG.OPENOFFICE.YEARS([.$C128];TODAY();0)) -> 
D129: of:=IF(ISBLANK([.C129]); ""; ORG.OPENOFFICE.YEARS([.$C129];TODAY();0)) -> 
D130: of:=IF(ISBLANK([.C130]); ""; ORG.OPENOFFICE.YEARS([.$C130];TODAY();0)) -> 
D131: of:=IF(ISBLANK([.C131]); ""; ORG.OPENOFFICE.YEARS([.$C131];TODAY();0)) -> 
D132: of:=IF(ISBLANK([.C132]); ""; ORG.OPENOFFICE.YEARS([.$C132];TODAY();0)) -> 
D133: of:=IF(ISBLANK([.C133]); ""; ORG.OPENOFFICE.YEARS([.$C133];TODAY();0)) -> 
D134: of:=IF(ISBLANK([.C134]); ""; ORG.OPENOFFICE.YEARS([.$C134];TODAY();0)) -> 
D135: of:=IF(ISBLANK([.C135]); ""; ORG.OPENOFFICE.YEARS([.$C135];TODAY();0)) -> 
D136: of:=IF(ISBLANK([.C136]); ""; ORG.OPENOFFICE.YEARS([.$C136];TODAY();0)) -> 
D137: of:=IF(ISBLANK([.C137]); ""; ORG.OPENOFFICE.YEARS([.$C137];TODAY();0)) -> 
D138: of:=IF(ISBLANK([.C138]); ""; ORG.OPENOFFICE.YEARS([.$C138];TODAY();0)) -> 
D139: of:=IF(ISBLANK([.C139]); ""; ORG.OPENOFFICE.YEARS([.$C139];TODAY();0)) -> 
D140: of:=IF(ISBLANK([.C140]); ""; ORG.OPENOFFICE.YEARS([.$C140];TODAY();0)) -> 
D141: of:=IF(ISBLANK([.C141]); ""; ORG.OPENOFFICE.YEARS([.$C141];TODAY();0)) -> 
D142: of:=IF(ISBLANK([.C142]); ""; ORG.OPENOFFICE.YEARS([.$C142];TODAY();0)) -> 
D143: of:=IF(ISBLANK([.C143]); ""; ORG.OPENOFFICE.YEARS([.$C143];TODAY();0)) -> 
D144: of:=IF(ISBLANK([.C144]); ""; ORG.OPENOFFICE.YEARS([.$C144];TODAY();0)) -> 
D145: of:=IF(ISBLANK([.C145]); ""; ORG.OPENOFFICE.YEARS([.$C145];TODAY();0)) -> 
D146: of:=IF(ISBLANK([.C146]); ""; ORG.OPENOFFICE.YEARS([.$C146];TODAY();0)) -> 
D147: of:=IF(ISBLANK([.C147]); ""; ORG.OPENOFFICE.YEARS([.$C147];TODAY();0)) -> 
D148: of:=IF(ISBLANK([.C148]); ""; ORG.OPENOFFICE.YEARS([.$C148];TODAY();0)) -> 
D149: of:=IF(ISBLANK([.C149]); ""; ORG.OPENOFFICE.YEARS([.$C149];TODAY();0)) -> 
D150: of:=IF(ISBLANK([.C150]); ""; ORG.OPENOFFICE.YEARS([.$C150];TODAY();0)) -> 
D151: of:=IF(ISBLANK([.C151]); ""; ORG.OPENOFFICE.YEARS([.$C151];TODAY();0)) -> 
D152: of:=IF(ISBLANK([.C152]); ""; ORG.OPENOFFICE.YEARS([.$C152];TODAY();0)) -> 
D153: of:=IF(ISBLANK([.C153]); ""; ORG.OPENOFFICE.YEARS([.$C153];TODAY();0)) -> 
D154: of:=IF(ISBLANK([.C154]); ""; ORG.OPENOFFICE.YEARS([.$C154];TODAY();0)) -> 
D155: of:=IF(ISBLANK([.C155]); ""; ORG.OPENOFFICE.YEARS([.$C155];TODAY();0)) -> 
D156: of:=IF(ISBLANK([.C156]); ""; ORG.OPENOFFICE.YEARS([.$C156];TODAY();0)) -> 
D157: of:=IF(ISBLANK([.C157]); ""; ORG.OPENOFFICE.YEARS([.$C157];TODAY();0)) -> 
D158: of:=IF(ISBLANK([.C158]); ""; ORG.OPENOFFICE.YEARS([.$C158];TODAY();0)) -> 
D159: of:=IF(ISBLANK([.C159]); ""; ORG.OPENOFFICE.YEARS([.$C159];TODAY();0)) -> 
D160: of:=IF(ISBLANK([.C160]); ""; ORG.OPENOFFICE.YEARS([.$C160];TODAY();0)) -> 
D161: of:=IF(ISBLANK([.C161]); ""; ORG.OPENOFFICE.YEARS([.$C161];TODAY();0)) -> 
D162: of:=IF(ISBLANK([.C162]); ""; ORG.OPENOFFICE.YEARS([.$C162];TODAY();0)) -> 
D163: of:=IF(ISBLANK([.C163]); ""; ORG.OPENOFFICE.YEARS([.$C163];TODAY();0)) -> 
D164: of:=IF(ISBLANK([.C164]); ""; ORG.OPENOFFICE.YEARS([.$C164];TODAY();0)) -> 
D165: of:=IF(ISBLANK([.C165]); ""; ORG.OPENOFFICE.YEARS([.$C165];TODAY();0)) -> 
D166: of:=IF(ISBLANK([.C166]); ""; ORG.OPENOFFICE.YEARS([.$C166];TODAY();0)) -> 
D167: of:=IF(ISBLANK([.C167]); ""; ORG.OPENOFFICE.YEARS([.$C167];TODAY();0)) -> 
D168: of:=IF(ISBLANK([.C168]); ""; ORG.OPENOFFICE.YEARS([.$C168];TODAY();0)) -> 
D169: of:=IF(ISBLANK([.C169]); ""; ORG.OPENOFFICE.YEARS([.$C169];TODAY();0)) -> 
D170: of:=IF(ISBLANK([.C170]); ""; ORG.OPENOFFICE.YEARS([.$C170];TODAY();0)) -> 
D171: of:=IF(ISBLANK([.C171]); ""; ORG.OPENOFFICE.YEARS([.$C171];TODAY();0)) -> 
D172: of:=IF(ISBLANK([.C172]); ""; ORG.OPENOFFICE.YEARS([.$C172];TODAY();0)) -> 
D173: of:=IF(ISBLANK([.C173]); ""; ORG.OPENOFFICE.YEARS([.$C173];TODAY();0)) -> 
D174: of:=IF(ISBLANK([.C174]); ""; ORG.OPENOFFICE.YEARS([.$C174];TODAY();0)) -> 
D175: of:=IF(ISBLANK([.C175]); ""; ORG.OPENOFFICE.YEARS([.$C175];TODAY();0)) -> 
D176: of:=IF(ISBLANK([.C176]); ""; ORG.OPENOFFICE.YEARS([.$C176];TODAY();0)) -> 
D177: of:=IF(ISBLANK([.C177]); ""; ORG.OPENOFFICE.YEARS([.$C177];TODAY();0)) -> 
D178: of:=IF(ISBLANK([.C178]); ""; ORG.OPENOFFICE.YEARS([.$C178];TODAY();0)) -> 
D179: of:=IF(ISBLANK([.C179]); ""; ORG.OPENOFFICE.YEARS([.$C179];TODAY();0)) -> 
D180: of:=IF(ISBLANK([.C180]); ""; ORG.OPENOFFICE.YEARS([.$C180];TODAY();0)) -> 
D181: of:=IF(ISBLANK([.C181]); ""; ORG.OPENOFFICE.YEARS([.$C181];TODAY();0)) -> 
D182: of:=IF(ISBLANK([.C182]); ""; ORG.OPENOFFICE.YEARS([.$C182];TODAY();0)) -> 
D183: of:=IF(ISBLANK([.C183]); ""; ORG.OPENOFFICE.YEARS([.$C183];TODAY();0)) -> 
D184: of:=IF(ISBLANK([.C184]); ""; ORG.OPENOFFICE.YEARS([.$C184];TODAY();0)) -> 
D185: of:=IF(ISBLANK([.C185]); ""; ORG.OPENOFFICE.YEARS([.$C185];TODAY();0)) -> 
D186: of:=IF(ISBLANK([.C186]); ""; ORG.OPENOFFICE.YEARS([.$C186];TODAY();0)) -> 
D187: of:=IF(ISBLANK([.C187]); ""; ORG.OPENOFFICE.YEARS([.$C187];TODAY();0)) -> 
D188: of:=IF(ISBLANK([.C188]); ""; ORG.OPENOFFICE.YEARS([.$C188];TODAY();0)) -> 
D189: of:=IF(ISBLANK([.C189]); ""; ORG.OPENOFFICE.YEARS([.$C189];TODAY();0)) -> 
D190: of:=IF(ISBLANK([.C190]); ""; ORG.OPENOFFICE.YEARS([.$C190];TODAY();0)) -> 
D191: of:=IF(ISBLANK([.C191]); ""; ORG.OPENOFFICE.YEARS([.$C191];TODAY();0)) -> 
D192: of:=IF(ISBLANK([.C192]); ""; ORG.OPENOFFICE.YEARS([.$C192];TODAY();0)) -> 
D193: of:=IF(ISBLANK([.C193]); ""; ORG.OPENOFFICE.YEARS([.$C193];TODAY();0)) -> 
D194: of:=IF(ISBLANK([.C194]); ""; ORG.OPENOFFICE.YEARS([.$C194];TODAY();0)) -> 
D195: of:=IF(ISBLANK([.C195]); ""; ORG.OPENOFFICE.YEARS([.$C195];TODAY();0)) -> 
D196: of:=IF(ISBLANK([.C196]); ""; ORG.OPENOFFICE.YEARS([.$C196];TODAY();0)) -> 
D197: of:=IF(ISBLANK([.C197]); ""; ORG.OPENOFFICE.YEARS([.$C197];TODAY();0)) -> 
D198: of:=IF(ISBLANK([.C198]); ""; ORG.OPENOFFICE.YEARS([.$C198];TODAY();0)) -> 
D199: of:=IF(ISBLANK([.C199]); ""; ORG.OPENOFFICE.YEARS([.$C199];TODAY();0)) -> 
D200: of:=IF(ISBLANK([.C200]); ""; ORG.OPENOFFICE.YEARS([.$C200];TODAY();0)) -> 
D201: of:=IF(ISBLANK([.C201]); ""; ORG.OPENOFFICE.YEARS([.$C201];TODAY();0)) -> 
D202: of:=IF(ISBLANK([.C202]); ""; ORG.OPENOFFICE.YEARS([.$C202];TODAY();0)) -> 
D203: of:=IF(ISBLANK([.C203]); ""; ORG.OPENOFFICE.YEARS([.$C203];TODAY();0)) -> 
D204: of:=IF(ISBLANK([.C204]); ""; ORG.OPENOFFICE.YEARS([.$C204];TODAY();0)) -> 
D205: of:=IF(ISBLANK([.C205]); ""; ORG.OPENOFFICE.YEARS([.$C205];TODAY();0)) -> 
D206: of:=IF(ISBLANK([.C206]); ""; ORG.OPENOFFICE.YEARS([.$C206];TODAY();0)) -> 
D207: of:=IF(ISBLANK([.C207]); ""; ORG.OPENOFFICE.YEARS([.$C207];TODAY();0)) -> 
D208: of:=IF(ISBLANK([.C208]); ""; ORG.OPENOFFICE.YEARS([.$C208];TODAY();0)) -> 
D209: of:=IF(ISBLANK([.C209]); ""; ORG.OPENOFFICE.YEARS([.$C209];TODAY();0)) -> 
D210: of:=IF(ISBLANK([.C210]); ""; ORG.OPENOFFICE.YEARS([.$C210];TODAY();0)) -> 
D211: of:=IF(ISBLANK([.C211]); ""; ORG.OPENOFFICE.YEARS([.$C211];TODAY();0)) -> 
D212: of:=IF(ISBLANK([.C212]); ""; ORG.OPENOFFICE.YEARS([.$C212];TODAY();0)) -> 
D213: of:=IF(ISBLANK([.C213]); ""; ORG.OPENOFFICE.YEARS([.$C213];TODAY();0)) -> 
D214: of:=IF(ISBLANK([.C214]); ""; ORG.OPENOFFICE.YEARS([.$C214];TODAY();0)) -> 
D215: of:=IF(ISBLANK([.C215]); ""; ORG.OPENOFFICE.YEARS([.$C215];TODAY();0)) -> 
D216: of:=IF(ISBLANK([.C216]); ""; ORG.OPENOFFICE.YEARS([.$C216];TODAY();0)) -> 
D217: of:=IF(ISBLANK([.C217]); ""; ORG.OPENOFFICE.YEARS([.$C217];TODAY();0)) -> 
D218: of:=IF(ISBLANK([.C218]); ""; ORG.OPENOFFICE.YEARS([.$C218];TODAY();0)) -> 
D219: of:=IF(ISBLANK([.C219]); ""; ORG.OPENOFFICE.YEARS([.$C219];TODAY();0)) -> 
D220: of:=IF(ISBLANK([.C220]); ""; ORG.OPENOFFICE.YEARS([.$C220];TODAY();0)) -> 
D221: of:=IF(ISBLANK([.C221]); ""; ORG.OPENOFFICE.YEARS([.$C221];TODAY();0)) -> 
D222: of:=IF(ISBLANK([.C222]); ""; ORG.OPENOFFICE.YEARS([.$C222];TODAY();0)) -> 
D223: of:=IF(ISBLANK([.C223]); ""; ORG.OPENOFFICE.YEARS([.$C223];TODAY();0)) -> 
D224: of:=IF(ISBLANK([.C224]); ""; ORG.OPENOFFICE.YEARS([.$C224];TODAY();0)) -> 
D225: of:=IF(ISBLANK([.C225]); ""; ORG.OPENOFFICE.YEARS([.$C225];TODAY();0)) -> 
D226: of:=IF(ISBLANK([.C226]); ""; ORG.OPENOFFICE.YEARS([.$C226];TODAY();0)) -> 
D227: of:=IF(ISBLANK([.C227]); ""; ORG.OPENOFFICE.YEARS([.$C227];TODAY();0)) -> 
D228: of:=IF(ISBLANK([.C228]); ""; ORG.OPENOFFICE.YEARS([.$C228];TODAY();0)) -> 
D229: of:=IF(ISBLANK([.C229]); ""; ORG.OPENOFFICE.YEARS([.$C229];TODAY();0)) -> 
D230: of:=IF(ISBLANK([.C230]); ""; ORG.OPENOFFICE.YEARS([.$C230];TODAY();0)) -> 
D231: of:=IF(ISBLANK([.C231]); ""; ORG.OPENOFFICE.YEARS([.$C231];TODAY();0)) -> 
D232: of:=IF(ISBLANK([.C232]); ""; ORG.OPENOFFICE.YEARS([.$C232];TODAY();0)) -> 
D233: of:=IF(ISBLANK([.C233]); ""; ORG.OPENOFFICE.YEARS([.$C233];TODAY();0)) -> 
D234: of:=IF(ISBLANK([.C234]); ""; ORG.OPENOFFICE.YEARS([.$C234];TODAY();0)) -> 
D235: of:=IF(ISBLANK([.C235]); ""; ORG.OPENOFFICE.YEARS([.$C235];TODAY();0)) -> 
D236: of:=IF(ISBLANK([.C236]); ""; ORG.OPENOFFICE.YEARS([.$C236];TODAY();0)) -> 
D237: of:=IF(ISBLANK([.C237]); ""; ORG.OPENOFFICE.YEARS([.$C237];TODAY();0)) -> 
D238: of:=IF(ISBLANK([.C238]); ""; ORG.OPENOFFICE.YEARS([.$C238];TODAY();0)) -> 
D239: of:=IF(ISBLANK([.C239]); ""; ORG.OPENOFFICE.YEARS([.$C239];TODAY();0)) -> 
D240: of:=IF(ISBLANK([.C240]); ""; ORG.OPENOFFICE.YEARS([.$C240];TODAY();0)) -> 
D241: of:=IF(ISBLANK([.C241]); ""; ORG.OPENOFFICE.YEARS([.$C241];TODAY();0)) -> 
D242: of:=IF(ISBLANK([.C242]); ""; ORG.OPENOFFICE.YEARS([.$C242];TODAY();0)) -> 
D243: of:=IF(ISBLANK([.C243]); ""; ORG.OPENOFFICE.YEARS([.$C243];TODAY();0)) -> 
D244: of:=IF(ISBLANK([.C244]); ""; ORG.OPENOFFICE.YEARS([.$C244];TODAY();0)) -> 
D245: of:=IF(ISBLANK([.C245]); ""; ORG.OPENOFFICE.YEARS([.$C245];TODAY();0)) -> 
D246: of:=IF(ISBLANK([.C246]); ""; ORG.OPENOFFICE.YEARS([.$C246];TODAY();0)) -> 
D247: of:=IF(ISBLANK([.C247]); ""; ORG.OPENOFFICE.YEARS([.$C247];TODAY();0)) -> 
D248: of:=IF(ISBLANK([.C248]); ""; ORG.OPENOFFICE.YEARS([.$C248];TODAY();0)) -> 
D249: of:=IF(ISBLANK([.C249]); ""; ORG.OPENOFFICE.YEARS([.$C249];TODAY();0)) -> 
D250: of:=IF(ISBLANK([.C250]); ""; ORG.OPENOFFICE.YEARS([.$C250];TODAY();0)) -> 
D251: of:=IF(ISBLANK([.C251]); ""; ORG.OPENOFFICE.YEARS([.$C251];TODAY();0)) -> 
D252: of:=IF(ISBLANK([.C252]); ""; ORG.OPENOFFICE.YEARS([.$C252];TODAY();0)) -> 
D253: of:=IF(ISBLANK([.C253]); ""; ORG.OPENOFFICE.YEARS([.$C253];TODAY();0)) -> 
D254: of:=IF(ISBLANK([.C254]); ""; ORG.OPENOFFICE.YEARS([.$C254];TODAY();0)) -> 
D255: of:=IF(ISBLANK([.C255]); ""; ORG.OPENOFFICE.YEARS([.$C255];TODAY();0)) -> 
D256: of:=IF(ISBLANK([.C256]); ""; ORG.OPENOFFICE.YEARS([.$C256];TODAY();0)) -> 
D257: of:=IF(ISBLANK([.C257]); ""; ORG.OPENOFFICE.YEARS([.$C257];TODAY();0)) -> 
D258: of:=IF(ISBLANK([.C258]); ""; ORG.OPENOFFICE.YEARS([.$C258];TODAY();0)) -> 
D259: of:=IF(ISBLANK([.C259]); ""; ORG.OPENOFFICE.YEARS([.$C259];TODAY();0)) -> 
D260: of:=IF(ISBLANK([.C260]); ""; ORG.OPENOFFICE.YEARS([.$C260];TODAY();0)) -> 
D261: of:=IF(ISBLANK([.C261]); ""; ORG.OPENOFFICE.YEARS([.$C261];TODAY();0)) -> 
D262: of:=IF(ISBLANK([.C262]); ""; ORG.OPENOFFICE.YEARS([.$C262];TODAY();0)) -> 
D263: of:=IF(ISBLANK([.C263]); ""; ORG.OPENOFFICE.YEARS([.$C263];TODAY();0)) -> 
D264: of:=IF(ISBLANK([.C264]); ""; ORG.OPENOFFICE.YEARS([.$C264];TODAY();0)) -> 
D265: of:=IF(ISBLANK([.C265]); ""; ORG.OPENOFFICE.YEARS([.$C265];TODAY();0)) -> 
D266: of:=IF(ISBLANK([.C266]); ""; ORG.OPENOFFICE.YEARS([.$C266];TODAY();0)) -> 
D267: of:=IF(ISBLANK([.C267]); ""; ORG.OPENOFFICE.YEARS([.$C267];TODAY();0)) -> 
D268: of:=IF(ISBLANK([.C268]); ""; ORG.OPENOFFICE.YEARS([.$C268];TODAY();0)) -> 
D269: of:=IF(ISBLANK([.C269]); ""; ORG.OPENOFFICE.YEARS([.$C269];TODAY();0)) -> 
D270: of:=IF(ISBLANK([.C270]); ""; ORG.OPENOFFICE.YEARS([.$C270];TODAY();0)) -> 
D271: of:=IF(ISBLANK([.C271]); ""; ORG.OPENOFFICE.YEARS([.$C271];TODAY();0)) -> 
D272: of:=IF(ISBLANK([.C272]); ""; ORG.OPENOFFICE.YEARS([.$C272];TODAY();0)) -> 
D273: of:=IF(ISBLANK([.C273]); ""; ORG.OPENOFFICE.YEARS([.$C273];TODAY();0)) -> 
D274: of:=IF(ISBLANK([.C274]); ""; ORG.OPENOFFICE.YEARS([.$C274];TODAY();0)) -> 
D275: of:=IF(ISBLANK([.C275]); ""; ORG.OPENOFFICE.YEARS([.$C275];TODAY();0)) -> 
D276: of:=IF(ISBLANK([.C276]); ""; ORG.OPENOFFICE.YEARS([.$C276];TODAY();0)) -> 
D277: of:=IF(ISBLANK([.C277]); ""; ORG.OPENOFFICE.YEARS([.$C277];TODAY();0)) -> 
D278: of:=IF(ISBLANK([.C278]); ""; ORG.OPENOFFICE.YEARS([.$C278];TODAY();0)) -> 
D279: of:=IF(ISBLANK([.C279]); ""; ORG.OPENOFFICE.YEARS([.$C279];TODAY();0)) -> 
D280: of:=IF(ISBLANK([.C280]); ""; ORG.OPENOFFICE.YEARS([.$C280];TODAY();0)) -> 
D281: of:=IF(ISBLANK([.C281]); ""; ORG.OPENOFFICE.YEARS([.$C281];TODAY();0)) -> 
D282: of:=IF(ISBLANK([.C282]); ""; ORG.OPENOFFICE.YEARS([.$C282];TODAY();0)) -> 
D283: of:=IF(ISBLANK([.C283]); ""; ORG.OPENOFFICE.YEARS([.$C283];TODAY();0)) -> 
D284: of:=IF(ISBLANK([.C284]); ""; ORG.OPENOFFICE.YEARS([.$C284];TODAY();0)) -> 
D285: of:=IF(ISBLANK([.C285]); ""; ORG.OPENOFFICE.YEARS([.$C285];TODAY();0)) -> 
D286: of:=IF(ISBLANK([.C286]); ""; ORG.OPENOFFICE.YEARS([.$C286];TODAY();0)) -> 
D287: of:=IF(ISBLANK([.C287]); ""; ORG.OPENOFFICE.YEARS([.$C287];TODAY();0)) -> 
D288: of:=IF(ISBLANK([.C288]); ""; ORG.OPENOFFICE.YEARS([.$C288];TODAY();0)) -> 
D289: of:=IF(ISBLANK([.C289]); ""; ORG.OPENOFFICE.YEARS([.$C289];TODAY();0)) -> 
D290: of:=IF(ISBLANK([.C290]); ""; ORG.OPENOFFICE.YEARS([.$C290];TODAY();0)) -> 
D291: of:=IF(ISBLANK([.C291]); ""; ORG.OPENOFFICE.YEARS([.$C291];TODAY();0)) -> 
D292: of:=IF(ISBLANK([.C292]); ""; ORG.OPENOFFICE.YEARS([.$C292];TODAY();0)) -> 
D293: of:=IF(ISBLANK([.C293]); ""; ORG.OPENOFFICE.YEARS([.$C293];TODAY();0)) -> 
D294: of:=IF(ISBLANK([.C294]); ""; ORG.OPENOFFICE.YEARS([.$C294];TODAY();0)) -> 
D295: of:=IF(ISBLANK([.C295]); ""; ORG.OPENOFFICE.YEARS([.$C295];TODAY();0)) -> 
D296: of:=IF(ISBLANK([.C296]); ""; ORG.OPENOFFICE.YEARS([.$C296];TODAY();0)) -> 
D297: of:=IF(ISBLANK([.C297]); ""; ORG.OPENOFFICE.YEARS([.$C297];TODAY();0)) -> 
D298: of:=IF(ISBLANK([.C298]); ""; ORG.OPENOFFICE.YEARS([.$C298];TODAY();0)) -> 
D299: of:=IF(ISBLANK([.C299]); ""; ORG.OPENOFFICE.YEARS([.$C299];TODAY();0)) -> 
D300: of:=IF(ISBLANK([.C300]); ""; ORG.OPENOFFICE.YEARS([.$C300];TODAY();0)) -> 
D301: of:=IF(ISBLANK([.C301]); ""; ORG.OPENOFFICE.YEARS([.$C301];TODAY();0)) -> 
D302: of:=IF(ISBLANK([.C302]); ""; ORG.OPENOFFICE.YEARS([.$C302];TODAY();0)) -> 
D303: of:=IF(ISBLANK([.C303]); ""; ORG.OPENOFFICE.YEARS([.$C303];TODAY();0)) -> 
D304: of:=IF(ISBLANK([.C304]); ""; ORG.OPENOFFICE.YEARS([.$C304];TODAY();0)) -> 
D305: of:=IF(ISBLANK([.C305]); ""; ORG.OPENOFFICE.YEARS([.$C305];TODAY();0)) -> 
D306: of:=IF(ISBLANK([.C306]); ""; ORG.OPENOFFICE.YEARS([.$C306];TODAY();0)) -> 
D307: of:=IF(ISBLANK([.C307]); ""; ORG.OPENOFFICE.YEARS([.$C307];TODAY();0)) -> 
D308: of:=IF(ISBLANK([.C308]); ""; ORG.OPENOFFICE.YEARS([.$C308];TODAY();0)) -> 
D309: of:=IF(ISBLANK([.C309]); ""; ORG.OPENOFFICE.YEARS([.$C309];TODAY();0)) -> 
D310: of:=IF(ISBLANK([.C310]); ""; ORG.OPENOFFICE.YEARS([.$C310];TODAY();0)) -> 
D311: of:=IF(ISBLANK([.C311]); ""; ORG.OPENOFFICE.YEARS([.$C311];TODAY();0)) -> 
D312: of:=IF(ISBLANK([.C312]); ""; ORG.OPENOFFICE.YEARS([.$C312];TODAY();0)) -> 
D313: of:=IF(ISBLANK([.C313]); ""; ORG.OPENOFFICE.YEARS([.$C313];TODAY();0)) -> 
D314: of:=IF(ISBLANK([.C314]); ""; ORG.OPENOFFICE.YEARS([.$C314];TODAY();0)) -> 
D315: of:=IF(ISBLANK([.C315]); ""; ORG.OPENOFFICE.YEARS([.$C315];TODAY();0)) -> 
D316: of:=IF(ISBLANK([.C316]); ""; ORG.OPENOFFICE.YEARS([.$C316];TODAY();0)) -> 
D317: of:=IF(ISBLANK([.C317]); ""; ORG.OPENOFFICE.YEARS([.$C317];TODAY();0)) -> 
D318: of:=IF(ISBLANK([.C318]); ""; ORG.OPENOFFICE.YEARS([.$C318];TODAY();0)) -> 
D319: of:=IF(ISBLANK([.C319]); ""; ORG.OPENOFFICE.YEARS([.$C319];TODAY();0)) -> 
D320: of:=IF(ISBLANK([.C320]); ""; ORG.OPENOFFICE.YEARS([.$C320];TODAY();0)) -> 
D321: of:=IF(ISBLANK([.C321]); ""; ORG.OPENOFFICE.YEARS([.$C321];TODAY();0)) -> 
D322: of:=IF(ISBLANK([.C322]); ""; ORG.OPENOFFICE.YEARS([.$C322];TODAY();0)) -> 
D323: of:=IF(ISBLANK([.C323]); ""; ORG.OPENOFFICE.YEARS([.$C323];TODAY();0)) -> 
D324: of:=IF(ISBLANK([.C324]); ""; ORG.OPENOFFICE.YEARS([.$C324];TODAY();0)) -> 
D325: of:=IF(ISBLANK([.C325]); ""; ORG.OPENOFFICE.YEARS([.$C325];TODAY();0)) -> 
D326: of:=IF(ISBLANK([.C326]); ""; ORG.OPENOFFICE.YEARS([.$C326];TODAY();0)) -> 
D327: of:=IF(ISBLANK([.C327]); ""; ORG.OPENOFFICE.YEARS([.$C327];TODAY();0)) -> 
D328: of:=IF(ISBLANK([.C328]); ""; ORG.OPENOFFICE.YEARS([.$C328];TODAY();0)) -> 
D329: of:=IF(ISBLANK([.C329]); ""; ORG.OPENOFFICE.YEARS([.$C329];TODAY();0)) -> 
D330: of:=IF(ISBLANK([.C330]); ""; ORG.OPENOFFICE.YEARS([.$C330];TODAY();0)) -> 
D331: of:=IF(ISBLANK([.C331]); ""; ORG.OPENOFFICE.YEARS([.$C331];TODAY();0)) -> 
D332: of:=IF(ISBLANK([.C332]); ""; ORG.OPENOFFICE.YEARS([.$C332];TODAY();0)) -> 
D333: of:=IF(ISBLANK([.C333]); ""; ORG.OPENOFFICE.YEARS([.$C333];TODAY();0)) -> 
D334: of:=IF(ISBLANK([.C334]); ""; ORG.OPENOFFICE.YEARS([.$C334];TODAY();0)) -> 
D335: of:=IF(ISBLANK([.C335]); ""; ORG.OPENOFFICE.YEARS([.$C335];TODAY();0)) -> 
D336: of:=IF(ISBLANK([.C336]); ""; ORG.OPENOFFICE.YEARS([.$C336];TODAY();0)) -> 
D337: of:=IF(ISBLANK([.C337]); ""; ORG.OPENOFFICE.YEARS([.$C337];TODAY();0)) -> 
D338: of:=IF(ISBLANK([.C338]); ""; ORG.OPENOFFICE.YEARS([.$C338];TODAY();0)) -> 
D339: of:=IF(ISBLANK([.C339]); ""; ORG.OPENOFFICE.YEARS([.$C339];TODAY();0)) -> 
D340: of:=IF(ISBLANK([.C340]); ""; ORG.OPENOFFICE.YEARS([.$C340];TODAY();0)) -> 
D341: of:=IF(ISBLANK([.C341]); ""; ORG.OPENOFFICE.YEARS([.$C341];TODAY();0)) -> 
D342: of:=IF(ISBLANK([.C342]); ""; ORG.OPENOFFICE.YEARS([.$C342];TODAY();0)) -> 
D343: of:=IF(ISBLANK([.C343]); ""; ORG.OPENOFFICE.YEARS([.$C343];TODAY();0)) -> 
D344: of:=IF(ISBLANK([.C344]); ""; ORG.OPENOFFICE.YEARS([.$C344];TODAY();0)) -> 
D345: of:=IF(ISBLANK([.C345]); ""; ORG.OPENOFFICE.YEARS([.$C345];TODAY();0)) -> 
D346: of:=IF(ISBLANK([.C346]); ""; ORG.OPENOFFICE.YEARS([.$C346];TODAY();0)) -> 
D347: of:=IF(ISBLANK([.C347]); ""; ORG.OPENOFFICE.YEARS([.$C347];TODAY();0)) -> 
D348: of:=IF(ISBLANK([.C348]); ""; ORG.OPENOFFICE.YEARS([.$C348];TODAY();0)) -> 
D349: of:=IF(ISBLANK([.C349]); ""; ORG.OPENOFFICE.YEARS([.$C349];TODAY();0)) -> 
D350: of:=IF(ISBLANK([.C350]); ""; ORG.OPENOFFICE.YEARS([.$C350];TODAY();0)) -> 
D351: of:=IF(ISBLANK([.C351]); ""; ORG.OPENOFFICE.YEARS([.$C351];TODAY();0)) -> 
D352: of:=IF(ISBLANK([.C352]); ""; ORG.OPENOFFICE.YEARS([.$C352];TODAY();0)) -> 
D353: of:=IF(ISBLANK([.C353]); ""; ORG.OPENOFFICE.YEARS([.$C353];TODAY();0)) -> 
D354: of:=IF(ISBLANK([.C354]); ""; ORG.OPENOFFICE.YEARS([.$C354];TODAY();0)) -> 
D355: of:=IF(ISBLANK([.C355]); ""; ORG.OPENOFFICE.YEARS([.$C355];TODAY();0)) -> 
D356: of:=IF(ISBLANK([.C356]); ""; ORG.OPENOFFICE.YEARS([.$C356];TODAY();0)) -> 
D357: of:=IF(ISBLANK([.C357]); ""; ORG.OPENOFFICE.YEARS([.$C357];TODAY();0)) -> 
D358: of:=IF(ISBLANK([.C358]); ""; ORG.OPENOFFICE.YEARS([.$C358];TODAY();0)) -> 
D359: of:=IF(ISBLANK([.C359]); ""; ORG.OPENOFFICE.YEARS([.$C359];TODAY();0)) -> 
D360: of:=IF(ISBLANK([.C360]); ""; ORG.OPENOFFICE.YEARS([.$C360];TODAY();0)) -> 
D361: of:=IF(ISBLANK([.C361]); ""; ORG.OPENOFFICE.YEARS([.$C361];TODAY();0)) -> 
D362: of:=IF(ISBLANK([.C362]); ""; ORG.OPENOFFICE.YEARS([.$C362];TODAY();0)) -> 
D363: of:=IF(ISBLANK([.C363]); ""; ORG.OPENOFFICE.YEARS([.$C363];TODAY();0)) -> 
D364: of:=IF(ISBLANK([.C364]); ""; ORG.OPENOFFICE.YEARS([.$C364];TODAY();0)) -> 
D365: of:=IF(ISBLANK([.C365]); ""; ORG.OPENOFFICE.YEARS([.$C365];TODAY();0)) -> 
D366: of:=IF(ISBLANK([.C366]); ""; ORG.OPENOFFICE.YEARS([.$C366];TODAY();0)) -> 
D367: of:=IF(ISBLANK([.C367]); ""; ORG.OPENOFFICE.YEARS([.$C367];TODAY();0)) -> 
D368: of:=IF(ISBLANK([.C368]); ""; ORG.OPENOFFICE.YEARS([.$C368];TODAY();0)) -> 
D369: of:=IF(ISBLANK([.C369]); ""; ORG.OPENOFFICE.YEARS([.$C369];TODAY();0)) -> 
D370: of:=IF(ISBLANK([.C370]); ""; ORG.OPENOFFICE.YEARS([.$C370];TODAY();0)) -> 
D371: of:=IF(ISBLANK([.C371]); ""; ORG.OPENOFFICE.YEARS([.$C371];TODAY();0)) -> 
D372: of:=IF(ISBLANK([.C372]); ""; ORG.OPENOFFICE.YEARS([.$C372];TODAY();0)) -> 
D373: of:=IF(ISBLANK([.C373]); ""; ORG.OPENOFFICE.YEARS([.$C373];TODAY();0)) -> 
D374: of:=IF(ISBLANK([.C374]); ""; ORG.OPENOFFICE.YEARS([.$C374];TODAY();0)) -> 
D375: of:=IF(ISBLANK([.C375]); ""; ORG.OPENOFFICE.YEARS([.$C375];TODAY();0)) -> 
D376: of:=IF(ISBLANK([.C376]); ""; ORG.OPENOFFICE.YEARS([.$C376];TODAY();0)) -> 
D377: of:=IF(ISBLANK([.C377]); ""; ORG.OPENOFFICE.YEARS([.$C377];TODAY();0)) -> 
D378: of:=IF(ISBLANK([.C378]); ""; ORG.OPENOFFICE.YEARS([.$C378];TODAY();0)) -> 
D379: of:=IF(ISBLANK([.C379]); ""; ORG.OPENOFFICE.YEARS([.$C379];TODAY();0)) -> 
D380: of:=IF(ISBLANK([.C380]); ""; ORG.OPENOFFICE.YEARS([.$C380];TODAY();0)) -> 
D381: of:=IF(ISBLANK([.C381]); ""; ORG.OPENOFFICE.YEARS([.$C381];TODAY();0)) -> 
D382: of:=IF(ISBLANK([.C382]); ""; ORG.OPENOFFICE.YEARS([.$C382];TODAY();0)) -> 
D383: of:=IF(ISBLANK([.C383]); ""; ORG.OPENOFFICE.YEARS([.$C383];TODAY();0)) -> 
D384: of:=IF(ISBLANK([.C384]); ""; ORG.OPENOFFICE.YEARS([.$C384];TODAY();0)) -> 
D385: of:=IF(ISBLANK([.C385]); ""; ORG.OPENOFFICE.YEARS([.$C385];TODAY();0)) -> 
D386: of:=IF(ISBLANK([.C386]); ""; ORG.OPENOFFICE.YEARS([.$C386];TODAY();0)) -> 
D387: of:=IF(ISBLANK([.C387]); ""; ORG.OPENOFFICE.YEARS([.$C387];TODAY();0)) -> 
D388: of:=IF(ISBLANK([.C388]); ""; ORG.OPENOFFICE.YEARS([.$C388];TODAY();0)) -> 
D389: of:=IF(ISBLANK([.C389]); ""; ORG.OPENOFFICE.YEARS([.$C389];TODAY();0)) -> 
D390: of:=IF(ISBLANK([.C390]); ""; ORG.OPENOFFICE.YEARS([.$C390];TODAY();0)) -> 
D391: of:=IF(ISBLANK([.C391]); ""; ORG.OPENOFFICE.YEARS([.$C391];TODAY();0)) -> 
D392: of:=IF(ISBLANK([.C392]); ""; ORG.OPENOFFICE.YEARS([.$C392];TODAY();0)) -> 
D393: of:=IF(ISBLANK([.C393]); ""; ORG.OPENOFFICE.YEARS([.$C393];TODAY();0)) -> 
D394: of:=IF(ISBLANK([.C394]); ""; ORG.OPENOFFICE.YEARS([.$C394];TODAY();0)) -> 
D395: of:=IF(ISBLANK([.C395]); ""; ORG.OPENOFFICE.YEARS([.$C395];TODAY();0)) -> 
D396: of:=IF(ISBLANK([.C396]); ""; ORG.OPENOFFICE.YEARS([.$C396];TODAY();0)) -> 
D397: of:=IF(ISBLANK([.C397]); ""; ORG.OPENOFFICE.YEARS([.$C397];TODAY();0)) -> 

Sheet: Doc
A1: ID | B1: Name | C1: Donation | D1: Visits past month | E1: Upcoming visits | F1: Combined visits | G1: Unavailable from | H1: Unavailable till | I1: Phone Number | J1: Address | K1: Opening hours | L1: Languages | P1: Serices Offered
A2: D1 | B2: Diane | C2: yes | D2: of:=COUNTIFS([$Appointments.$D$1:$Appointments.$D$1048576];[.$A2];[$Appointments.$F$1:$Appointments.$F$1048576];">="&TODAY()-30) -> 1 | E2: of:=COUNTIFS([$Appointments.$D$1:$Appointments.$D$1048576];[.$A2];[$Appointments.$F$1:$Appointments.$F$1048576];">="&TODAY()) -> 0 | F2: of:=SUM([.D2:.E2]) -> 1 | G2: 2020-01-10 | H2: 2020-02-10 | J2: Am Badeteich | K2: Montags - Freitags 10-12 14-16 Samstag 10-12 Sonntag Geschlossen | P2: Snuggles | Q2: Pills
A3: D2 | B3: Dean | C3: yes | D3: of:=COUNTIFS([$Appointments.$D$1:$Appointments.$D$1048576];[.$A3];[$Appointments.$F$1:$Appointments.$F$1048576];">="&TODAY()-30) -> 2 | E3: of:=COUNTIFS([$Appointments.$D$1:$Appointments.$D$1048576];[.$A3];[$Appointments.$F$1:$Appointments.$F$1048576];">="&TODAY()) -> 0 | F3: of:=SUM([.D3:.E3]) -> 2 | G3: 2020-01-02 | H3: 2020-02-02 | J3: Adress1 | P3: Pills
A4: D3 | B4: Don | C4: yes | D4: of:=COUNTIFS([$Appointments.$D$1:$Appointments.$D$1048576];[.$A4];[$Appointments.$F$1:$Appointments.$F$1048576];">="&TODAY()-30) -> 0 | E4: of:=COUNTIFS([$Appointments.$D$1:$Appointments.$D$1048576];[.$A4];[$Appointments.$F$1:$Appointments.$F$1048576];">="&TODAY()) -> 0 | F4: of:=SUM([.D4:.E4]) -> 0 | J4: Adress2 | P4: Sleeping
A5: D4 | B5: Donna | C5: yes | D5: of:=COUNTIFS([$Appointments.$D$1:$Appointments.$D$1048576];[.$A5];[$Appointments.$F$1:$Appointments.$F$1048576];">="&TODAY()-30) -> 2 | E5: of:=COUNTIFS([$Appointments.$D$1:$Appointments.$D$1048576];[.$A5];[$Appointments.$F$1:$Appointments.$F$1048576];">="&TODAY()) -> 0 | F5: of:=SUM([.D5:.E5]) -> 2 | J5: Adress3 | P5: Pills
A6: D5 | B6: Diablo | C6: yes | D6: of:=COUNTIFS([$Appointments.$D$1:$Appointments.$D$1048576];[.$A6];[$Appointments.$F$1:$Appointments.$F$1048576];">="&TODAY()-30) -> 0 | E6: of:=COUNTIFS([$Appointments.$D$1:$Appointments.$D$1048576];[.$A6];[$Appointments.$F$1:$Appointments.$F$1048576];">="&TODAY()) -> 0 | F6: of:=SUM([.D6:.E6]) -> 0 | J6: Adress4 | P6: Throat | Q6: Ears | R6: Mouth
A7: D6 | B7: Digga | C7: no | D7: of:=COUNTIFS([$Appointments.$D$1:$Appointments.$D$1048576];[.$A7];[$Appointments.$F$1:$Appointments.$F$1048576];">="&TODAY()-30) -> 0 | E7: of:=COUNTIFS([$Appointments.$D$1:$Appointments.$D$1048576];[.$A7];[$Appointments.$F$1:$Appointments.$F$1048576];">="&TODAY()) -> 0 | F7: of:=SUM([.D7:.E7]) -> 0 | J7: Adress5 | L7: Strase | O7: walla | P7: Knife | Q7: Nose | V7: brabb
A8: D7 | B8: Dingo | C8: no | D8: of:=COUNTIFS([$Appointments.$D$1:$Appointments.$D$1048576];[.$A8];[$Appointments.$F$1:$Appointments.$F$1048576];">="&TODAY()-30) -> 1 | E8: of:=COUNTIFS([$Appointments.$D$1:$Appointments.$D$1048576];[.$A8];[$Appointments.$F$1:$Appointments.$F$1048576];">="&TODAY()) -> 0 | F8: of:=SUM([.D8:.E8]) -> 1 | J8: Adress6 | S8: AX
A9: D8 | D9: of:=COUNTIFS([$Appointments.$D$1:$Appointments.$D$1048576];[.$A9];[$Appointments.$F$1:$Appointments.$F$1048576];">="&TODAY()-30) -> 0 | E9: of:=COUNTIFS([$Appointments.$D$1:$Appointments.$D$1048576];[.$A9];[$Appointments.$F$1:$Appointments.$F$1048576];">="&TODAY()) -> 0 | F9: of:=SUM([.D9:.E9]) -> 0 | J9: Adress7
A10: D9 | D10: of:=COUNTIFS([$Appointments.$D$1:$Appointments.$D$1048576];[.$A10];[$Appointments.$F$1:$Appointments.$F$1048576];">="&TODAY()-30) -> 1 | E10: of:=COUNTIFS([$Appointments.$D$1:$Appointments.$D$1048576];[.$A10];[$Appointments.$F$1:$Appointments.$F$1048576];">="&TODAY()) -> 0 | F10: of:=SUM([.D10:.E10]) -> 1 | J10: Adress8
A11: D10 | D11: of:=COUNTIFS([$Appointments.$D$1:$Appointments.$D$1048576];[.$A11];[$Appointments.$F$1:$Appointments.$F$1048576];">="&TODAY()-30) -> 0 | E11: of:=COUNTIFS([$Appointments.$D$1:$Appointments.$D$1048576];[.$A11];[$Appointments.$F$1:$Appointments.$F$1048576];">="&TODAY()) -> 0 | F11: of:=SUM([.D11:.E11]) -> 0 | J11: Adress9
A12: D11 | D12: of:=COUNTIFS([$Appointments.$D$1:$Appointments.$D$1048576];[.$A12];[$Appointments.$F$1:$Appointments.$F$1048576];">="&TODAY()-30) -> 2 | E12: of:=COUNTIFS([$Appointments.$D$1:$Appointments.$D$1048576];[.$A12];[$Appointments.$F$1:$Appointments.$F$1048576];">="&TODAY()) -> 0 | F12: of:=SUM([.D12:.E12]) -> 2 | J12: Adress10
J13: Adress11
J14: Adress12
J15: Adress13

Sheet: Appointments
A1: ID | B1: Patient ID | C1: Patient Name | D1: Doc ID | E1: Doc Name | F1: Date | G1: Reason
A2: A1 | B2: P1 | C2: of:=IF(IFNA(INDEX([$Patients.$B$1:$Patients.$B$1048576];MATCH([.$B2];[$Patients.$A$1:$Patients.$A$1048576];0);0); "")=0; ""; IFNA(INDEX([$Patients.$B$1:$Patients.$B$1048576];MATCH([.$B2];[$Patients.$A$1:$Patients.$A$1048576];0);0); "")) -> Powell | D2: D3 | E2: of:=IF(IFNA(INDEX([$Doc.$B$1:$Doc.$B$1048576];MATCH([.$D2];[$Doc.$A$1:$Doc.$A$1048576];0);0); "")=0; "";IFNA(INDEX([$Doc.$B$1:$Doc.$B$1048576];MATCH([.$D2];[$Doc.$A$1:$Doc.$A$1048576];0);0); "")) -> Don | F2: 2020-02-01 | G2: Cough
A3: A2 | B3: P2 | C3: of:=IF(IFNA(INDEX([$Patients.$B$1:$Patients.$B$1048576];MATCH([.$B3];[$Patients.$A$1:$Patients.$A$1048576];0);0); "")=0; ""; IFNA(INDEX([$Patients.$B$1:$Patients.$B$1048576];MATCH([.$B3];[$Patients.$A$1:$Patients.$A$1048576];0);0); "")) -> Pablo | D3: D5 | E3: of:=IF(IFNA(INDEX([$Doc.$B$1:$Doc.$B$1048576];MATCH([.$D3];[$Doc.$A$1:$Doc.$A$1048576];0);0); "")=0; "";IFNA(INDEX([$Doc.$B$1:$Doc.$B$1048576];MATCH([.$D3];[$Doc.$A$1:$Doc.$A$1048576];0);0); "")) -> Diablo | F3: 2020-02-02 | G3: Heartache
A4: A3 | B4: P3 | C4: of:=IF(IFNA(INDEX([$Patients.$B$1:$Patients.$B$1048576];MATCH([.$B4];[$Patients.$A$1:$Patients.$A$1048576];0);0); "")=0; ""; IFNA(INDEX([$Patients.$B$1:$Patients.$B$1048576];MATCH([.$B4];[$Patients.$A$1:$Patients.$A$1048576];0);0); "")) -> Pavel | D4: D6 | E4: of:=IF(IFNA(INDEX([$Doc.$B$1:$Doc.$B$1048576];MATCH([.$D4];[$Doc.$A$1:$Doc.$A$1048576];0);0); "")=0; "";IFNA(INDEX([$Doc.$B$1:$Doc.$B$1048576];MATCH([.$D4];[$Doc.$A$1:$Doc.$A$1048576];0);0); "")) -> Digga | F4: 2020-02-03 | G4: Who knows
A5: A4 | B5: P5 | C5: of:=IF(IFNA(INDEX([$Patients.$B$1:$Patients.$B$1048576];MATCH([.$B5];[$Patients.$A$1:$Patients.$A$1048576];0);0); "")=0; ""; IFNA(INDEX([$Patients.$B$1:$Patients.$B$1048576];MATCH([.$B5];[$Patients.$A$1:$Patients.$A$1048576];0);0); "")) -> Pille | D5: D1 | E5: of:=IF(IFNA(INDEX([$Doc.$B$1:$Doc.$B$1048576];MATCH([.$D5];[$Doc.$A$1:$Doc.$A$1048576];0);0); "")=0; "";IFNA(INDEX([$Doc.$B$1:$Doc.$B$1048576];MATCH([.$D5];[$Doc.$A$1:$Doc.$A$1048576];0);0); "")) -> Diane | F5: 2020-02-04 | G5: Not me
A6: A5 | B6: P6 | C6: of:=IF(IFNA(INDEX([$Patients.$B$1:$Patients.$B$1048576];MATCH([.$B6];[$Patients.$A$1:$Patients.$A$1048576];0);0); "")=0; ""; IFNA(INDEX([$Patients.$B$1:$Patients.$B$1048576];MATCH([.$B6];[$Patients.$A$1:$Patients.$A$1048576];0);0); "")) -> Pong | D6: D2 | E6: of:=IF(IFNA(INDEX([$Doc.$B$1:$Doc.$B$1048576];MATCH([.$D6];[$Doc.$A$1:$Doc.$A$1048576];0);0); "")=0; "";IFNA(INDEX([$Doc.$B$1:$Doc.$B$1048576];MATCH([.$D6];[$Doc.$A$1:$Doc.$A$1048576];0);0); "")) -> Dean | F6: 2020-02-05 | G6: you
A7: A6 | B7: P7 | C7: of:=IF(IFNA(INDEX([$Patients.$B$1:$Patients.$B$1048576];MATCH([.$B7];[$Patients.$A$1:$Patients.$A$1048576];0);0); "")=0; ""; IFNA(INDEX([$Patients.$B$1:$Patients.$B$1048576];MATCH([.$B7];[$Patients.$A$1:$Patients.$A$1048576];0);0); "")) -> Perk | D7: D4 | E7: of:=IF(IFNA(INDEX([$Doc.$B$1:$Doc.$B$1048576];MATCH([.$D7];[$Doc.$A$1:$Doc.$A$1048576];0);0); "")=0; "";IFNA(INDEX([$Doc.$B$1:$Doc.$B$1048576];MATCH([.$D7];[$Doc.$A$1:$Doc.$A$1048576];0);0); "")) -> Donna | F7: 2020-02-06 | G7: us
A8: A7 | B8: P8 | C8: of:=IF(IFNA(INDEX([$Patients.$B$1:$Patients.$B$1048576];MATCH([.$B8];[$Patients.$A$1:$Patients.$A$1048576];0);0); "")=0; ""; IFNA(INDEX([$Patients.$B$1:$Patients.$B$1048576];MATCH([.$B8];[$Patients.$A$1:$Patients.$A$1048576];0);0); "")) -> Pal | D8: D7 | E8: of:=IF(IFNA(INDEX([$Doc.$B$1:$Doc.$B$1048576];MATCH([.$D8];[$Doc.$A$1:$Doc.$A$1048576];0);0); "")=0; "";IFNA(INDEX([$Doc.$B$1:$Doc.$B$1048576];MATCH([.$D8];[$Doc.$A$1:$Doc.$A$1048576];0);0); "")) -> Dingo | F8: 2020-02-07 | G8: Whatevs
A9: A8 | B9: P4 | C9: of:=IF(IFNA(INDEX([$Patients.$B$1:$Patients.$B$1048576];MATCH([.$B9];[$Patients.$A$1:$Patients.$A$1048576];0);0); "")=0; ""; IFNA(INDEX([$Patients.$B$1:$Patients.$B$1048576];MATCH([.$B9];[$Patients.$A$1:$Patients.$A$1048576];0);0); "")) -> Pol | D9: D2 | E9: of:=IF(IFNA(INDEX([$Doc.$B$1:$Doc.$B$1048576];MATCH([.$D9];[$Doc.$A$1:$Doc.$A$1048576];0);0); "")=0; "";IFNA(INDEX([$Doc.$B$1:$Doc.$B$1048576];MATCH([.$D9];[$Doc.$A$1:$Doc.$A$1048576];0);0); "")) -> Dean | F9: 2020-02-08 | G9: bum
A10: A9 | B10: P3 | C10: of:=IF(IFNA(INDEX([$Patients.$B$1:$Patients.$B$1048576];MATCH([.$B10];[$Patients.$A$1:$Patients.$A$1048576];0);0); "")=0; ""; IFNA(INDEX([$Patients.$B$1:$Patients.$B$1048576];MATCH([.$B10];[$Patients.$A$1:$Patients.$A$1048576];0);0); "")) -> Pavel | D10: D1 | E10: of:=IF(IFNA(INDEX([$Doc.$B$1:$Doc.$B$1048576];MATCH([.$D10];[$Doc.$A$1:$Doc.$A$1048576];0);0); "")=0; "";IFNA(INDEX([$Doc.$B$1:$Doc.$B$1048576];MATCH([.$D10];[$Doc.$A$1:$Doc.$A$1048576];0);0); "")) -> Diane | F10: 2020-02-20 | G10: bang
A11: A10 | B11: P4 | C11: of:=IF(IFNA(INDEX([$Patients.$B$1:$Patients.$B$1048576];MATCH([.$B11];[$Patients.$A$1:$Patients.$A$1048576];0);0); "")=0; ""; IFNA(INDEX([$Patients.$B$1:$Patients.$B$1048576];MATCH([.$B11];[$Patients.$A$1:$Patients.$A$1048576];0);0); "")) -> Pol | D11: D9 | E11: of:=IF(IFNA(INDEX([$Doc.$B$1:$Doc.$B$1048576];MATCH([.$D11];[$Doc.$A$1:$Doc.$A$1048576];0);0); "")=0; "";IFNA(INDEX([$Doc.$B$1:$Doc.$B$1048576];MATCH([.$D11];[$Doc.$A$1:$Doc.$A$1048576];0);0); "")) ->  | F11: 2020-02-10 | G11: wamm
A12: A11 | B12: P5 | C12: of:=IF(IFNA(INDEX([$Patients.$B$1:$Patients.$B$1048576];MATCH([.$B12];[$Patients.$A$1:$Patients.$A$1048576];0);0); "")=0; ""; IFNA(INDEX([$Patients.$B$1:$Patients.$B$1048576];MATCH([.$B12];[$Patients.$A$1:$Patients.$A$1048576];0);0); "")) -> Pille | D12: D11 | E12: of:=IF(IFNA(INDEX([$Doc.$B$1:$Doc.$B$1048576];MATCH([.$D12];[$Doc.$A$1:$Doc.$A$1048576];0);0); "")=0; "";IFNA(INDEX([$Doc.$B$1:$Doc.$B$1048576];MATCH([.$D12];[$Doc.$A$1:$Doc.$A$1048576];0);0); "")) ->  | F12: 2020-02-11 | G12: Zing
A13: A12 | B13: P4 | C13: of:=IF(IFNA(INDEX([$Patients.$B$1:$Patients.$B$1048576];MATCH([.$B13];[$Patients.$A$1:$Patients.$A$1048576];0);0); "")=0; ""; IFNA(INDEX([$Patients.$B$1:$Patients.$B$1048576];MATCH([.$B13];[$Patients.$A$1:$Patients.$A$1048576];0);0); "")) -> Pol | D13: D11 | E13: of:=IF(IFNA(INDEX([$Doc.$B$1:$Doc.$B$1048576];MATCH([.$D13];[$Doc.$A$1:$Doc.$A$1048576];0);0); "")=0; "";IFNA(INDEX([$Doc.$B$1:$Doc.$B$1048576];MATCH([.$D13];[$Doc.$A$1:$Doc.$A$1048576];0);0); "")) ->  | F13: 2020-02-12 | G13: Zack
A14: A13 | B14: P5 | C14: of:=IF(IFNA(INDEX([$Patients.$B$1:$Patients.$B$1048576];MATCH([.$B14];[$Patients.$A$1:$Patients.$A$1048576];0);0); "")=0; ""; IFNA(INDEX([$Patients.$B$1:$Patients.$B$1048576];MATCH([.$B14];[$Patients.$A$1:$Patients.$A$1048576];0);0); "")) -> Pille | E14: of:=IF(IFNA(INDEX([$Doc.$B$1:$Doc.$B$1048576];MATCH([.$D14];[$Doc.$A$1:$Doc.$A$1048576];0);0); "")=0; "";IFNA(INDEX([$Doc.$B$1:$Doc.$B$1048576];MATCH([.$D14];[$Doc.$A$1:$Doc.$A$1048576];0);0); "")) ->  | F14: 2020-02-13 | G14: TEST
A15: A14 | B15: P5 | C15: of:=IF(IFNA(INDEX([$Patients.$B$1:$Patients.$B$1048576];MATCH([.$B15];[$Patients.$A$1:$Patients.$A$1048576];0);0); "")=0; ""; IFNA(INDEX([$Patients.$B$1:$Patients.$B$1048576];MATCH([.$B15];[$Patients.$A$1:$Patients.$A$1048576];0);0); "")) -> Pille | E15: of:=IF(IFNA(INDEX([$Doc.$B$1:$Doc.$B$1048576];MATCH([.$D15];[$Doc.$A$1:$Doc.$A$1048576];0);0); "")=0; "";IFNA(INDEX([$Doc.$B$1:$Doc.$B$1048576];MATCH([.$D15];[$Doc.$A$1:$Doc.$A$1048576];0);0); "")) ->  | F15: 2020-02-14 | G15: TEST
A16: A15 | B16: P12 | C16: of:=IF(IFNA(INDEX([$Patients.$B$1:$Patients.$B$1048576];MATCH([.$B16];[$Patients.$A$1:$Patients.$A$1048576];0);0); "")=0; ""; IFNA(INDEX([$Patients.$B$1:$Patients.$B$1048576];MATCH([.$B16];[$Patients.$A$1:$Patients.$A$1048576];0);0); "")) -> Dork | E16: of:=IF(IFNA(INDEX([$Doc.$B$1:$Doc.$B$1048576];MATCH([.$D16];[$Doc.$A$1:$Doc.$A$1048576];0);0); "")=0; "";IFNA(INDEX([$Doc.$B$1:$Doc.$B$1048576];MATCH([.$D16];[$Doc.$A$1:$Doc.$A$1048576];0);0); "")) ->  | F16: 2020-02-15 | G16: TEST
A17: A16 | B17: P4 | C17: of:=IF(IFNA(INDEX([$Patients.$B$1:$Patients.$B$1048576];MATCH([.$B17];[$Patients.$A$1:$Patients.$A$1048576];0);0); "")=0; ""; IFNA(INDEX([$Patients.$B$1:$Patients.$B$1048576];MATCH([.$B17];[$Patients.$A$1:$Patients.$A$1048576];0);0); "")) -> Pol | D17: D4 | E17: of:=IF(IFNA(INDEX([$Doc.$B$1:$Doc.$B$1048576];MATCH([.$D17];[$Doc.$A$1:$Doc.$A$1048576];0);0); "")=0; "";IFNA(INDEX([$Doc.$B$1:$Doc.$B$1048576];MATCH([.$D17];[$Doc.$A$1:$Doc.$A$1048576];0);0); "")) -> Donna | F17: 2020-02-16 | G17: zeppo
A18: A17 | B18: P5 | C18: of:=IF(IFNA(INDEX([$Patients.$B$1:$Patients.$B$1048576];MATCH([.$B18];[$Patients.$A$1:$Patients.$A$1048576];0);0); "")=0; ""; IFNA(INDEX([$Patients.$B$1:$Patients.$B$1048576];MATCH([.$B18];[$Patients.$A$1:$Patients.$A$1048576];0);0); "")) -> Pille | E18: of:=IF(IFNA(INDEX([$Doc.$B$1:$Doc.$B$1048576];MATCH([.$D18];[$Doc.$A$1:$Doc.$A$1048576];0);0); "")=0; "";IFNA(INDEX([$Doc.$B$1:$Doc.$B$1048576];MATCH([.$D18];[$Doc.$A$1:$Doc.$A$1048576];0);0); "")) ->  | F18: 2020-02-17 | G18: ziro
A19: A18 | C19: of:=IF(IFNA(INDEX([$Patients.$B$1:$Patients.$B$1048576];MATCH([.$B19];[$Patients.$A$1:$Patients.$A$1048576];0);0); "")=0; ""; IFNA(INDEX([$Patients.$B$1:$Patients.$B$1048576];MATCH([.$B19];[$Patients.$A$1:$Patients.$A$1048576];0);0); "")) ->  | E19: of:=IF(IFNA(INDEX([$Doc.$B$1:$Doc.$B$1048576];MATCH([.$D19];[$Doc.$A$1:$Doc.$A$1048576];0);0); "")=0; "";IFNA(INDEX([$Doc.$B$1:$Doc.$B$1048576];MATCH([.$D19];[$Doc.$A$1:$Doc.$A$1048576];0);0); "")) ->  | F19: 2020-02-18
A20: A19 | C20: of:=IF(IFNA(INDEX([$Patients.$B$1:$Patients.$B$1048576];MATCH([.$B20];[$Patients.$A$1:$Patients.$A$1048576];0);0); "")=0; ""; IFNA(INDEX([$Patients.$B$1:$Patients.$B$1048576];MATCH([.$B20];[$Patients.$A$1:$Patients.$A$1048576];0);0); "")) ->  | E20: of:=IF(IFNA(INDEX([$Doc.$B$1:$Doc.$B$1048576];MATCH([.$D20];[$Doc.$A$1:$Doc.$A$1048576];0);0); "")=0; "";IFNA(INDEX([$Doc.$B$1:$Doc.$B$1048576];MATCH([.$D20];[$Doc.$A$1:$Doc.$A$1048576];0);0); "")) ->  | F20: 2020-02-19
A21: A20 | C21: of:=IF(IFNA(INDEX([$Patients.$B$1:$Patients.$B$1048576];MATCH([.$B21];[$Patients.$A$1:$Patients.$A$1048576];0);0); "")=0; ""; IFNA(INDEX([$Patients.$B$1:$Patients.$B$1048576];MATCH([.$B21];[$Patients.$A$1:$Patients.$A$1048576];0);0); "")) ->  | E21: of:=IF(IFNA(INDEX([$Doc.$B$1:$Doc.$B$1048576];MATCH([.$D21];[$Doc.$A$1:$Doc.$A$1048576];0);0); "")=0; "";IFNA(INDEX([$Doc.$B$1:$Doc.$B$1048576];MATCH([.$D21];[$Doc.$A$1:$Doc.$A$1048576];0);0); "")) ->  | F21: 2020-02-20
A22: A21 | C22: of:=IF(IFNA(INDEX([$Patients.$B$1:$Patients.$B$1048576];MATCH([.$B22];[$Patients.$A$1:$Patients.$A$1048576];0);0); "")=0; ""; IFNA(INDEX([$Patients.$B$1:$Patients.$B$1048576];MATCH([.$B22];[$Patients.$A$1:$Patients.$A$1048576];0);0); "")) ->  | E22: of:=IF(IFNA(INDEX([$Doc.$B$1:$Doc.$B$1048576];MATCH([.$D22];[$Doc.$A$1:$Doc.$A$1048576];0);0); "")=0; "";IFNA(INDEX([$Doc.$B$1:$Doc.$B$1048576];MATCH([.$D22];[$Doc.$A$1:$Doc.$A$1048576];0);0); "")) ->  | F22: 2020-02-21
A23: A22 | C23: of:=IF(IFNA(INDEX([$Patients.$B$1:$Patients.$B$1048576];MATCH([.$B23];[$Patients.$A$1:$Patients.$A$1048576];0);0); "")=0; ""; IFNA(INDEX([$Patients.$B$1:$Patients.$B$1048576];MATCH([.$B23];[$Patients.$A$1:$Patients.$A$1048576];0);0); "")) ->  | E23: of:=IF(IFNA(INDEX([$Doc.$B$1:$Doc.$B$1048576];MATCH([.$D23];[$Doc.$A$1:$Doc.$A$1048576];0);0); "")=0; "";IFNA(INDEX([$Doc.$B$1:$Doc.$B$1048576];MATCH([.$D23];[$Doc.$A$1:$Doc.$A$1048576];0);0); "")) ->  | F23: 2020-02-22
A24: A23 | C24: of:=IF(IFNA(INDEX([$Patients.$B$1:$Patients.$B$1048576];MATCH([.$B24];[$Patients.$A$1:$Patients.$A$1048576];0);0); "")=0; ""; IFNA(INDEX([$Patients.$B$1:$Patients.$B$1048576];MATCH([.$B24];[$Patients.$A$1:$Patients.$A$1048576];0);0); "")) ->  | E24: of:=IF(IFNA(INDEX([$Doc.$B$1:$Doc.$B$1048576];MATCH([.$D24];[$Doc.$A$1:$Doc.$A$1048576];0);0); "")=0; "";IFNA(INDEX([$Doc.$B$1:$Doc.$B$1048576];MATCH([.$D24];[$Doc.$A$1:$Doc.$A$1048576];0);0); "")) ->  | F24: 2020-02-23
A25: A24 | C25: of:=IF(IFNA(INDEX([$Patients.$B$1:$Patients.$B$1048576];MATCH([.$B25];[$Patients.$A$1:$Patients.$A$1048576];0);0); "")=0; ""; IFNA(INDEX([$Patients.$B$1:$Patients.$B$1048576];MATCH([.$B25];[$Patients.$A$1:$Patients.$A$1048576];0);0); "")) ->  | E25: of:=IF(IFNA(INDEX([$Doc.$B$1:$Doc.$B$1048576];MATCH([.$D25];[$Doc.$A$1:$Doc.$A$1048576];0);0); "")=0; "";IFNA(INDEX([$Doc.$B$1:$Doc.$B$1048576];MATCH([.$D25];[$Doc.$A$1:$Doc.$A$1048576];0);0); "")) ->  | F25: 2020-02-24
C26: of:=IF(IFNA(INDEX([$Patients.$B$1:$Patients.$B$1048576];MATCH([.$B26];[$Patients.$A$1:$Patients.$A$1048576];0);0); "")=0; ""; IFNA(INDEX([$Patients.$B$1:$Patients.$B$1048576];MATCH([.$B26];[$Patients.$A$1:$Patients.$A$1048576];0);0); "")) ->  | E26: of:=IF(IFNA(INDEX([$Doc.$B$1:$Doc.$B$1048576];MATCH([.$D26];[$Doc.$A$1:$Doc.$A$1048576];0);0); "")=0; "";IFNA(INDEX([$Doc.$B$1:$Doc.$B$1048576];MATCH([.$D26];[$Doc.$A$1:$Doc.$A$1048576];0);0); "")) -> 
C27: of:=IF(IFNA(INDEX([$Patients.$B$1:$Patients.$B$1048576];MATCH([.$B27];[$Patients.$A$1:$Patients.$A$1048576];0);0); "")=0; ""; IFNA(INDEX([$Patients.$B$1:$Patients.$B$1048576];MATCH([.$B27];[$Patients.$A$1:$Patients.$A$1048576];0);0); "")) ->  | E27: of:=IF(IFNA(INDEX([$Doc.$B$1:$Doc.$B$1048576];MATCH([.$D27];[$Doc.$A$1:$Doc.$A$1048576];0);0); "")=0; "";IFNA(INDEX([$Doc.$B$1:$Doc.$B$1048576];MATCH([.$D27];[$Doc.$A$1:$Doc.$A$1048576];0);0); "")) -> 
C28: of:=IF(IFNA(INDEX([$Patients.$B$1:$Patients.$B$1048576];MATCH([.$B28];[$Patients.$A$1:$Patients.$A$1048576];0);0); "")=0; ""; IFNA(INDEX([$Patients.$B$1:$Patients.$B$1048576];MATCH([.$B28];[$Patients.$A$1:$Patients.$A$1048576];0);0); "")) ->  | E28: of:=IF(IFNA(INDEX([$Doc.$B$1:$Doc.$B$1048576];MATCH([.$D28];[$Doc.$A$1:$Doc.$A$1048576];0);0); "")=0; "";IFNA(INDEX([$Doc.$B$1:$Doc.$B$1048576];MATCH([.$D28];[$Doc.$A$1:$Doc.$A$1048576];0);0); "")) -> 
C29: of:=IF(IFNA(INDEX([$Patients.$B$1:$Patients.$B$1048576];MATCH([.$B29];[$Patients.$A$1:$Patients.$A$1048576];0);0); "")=0; ""; IFNA(INDEX([$Patients.$B$1:$Patients.$B$1048576];MATCH([.$B29];[$Patients.$A$1:$Patients.$A$1048576];0);0); "")) ->  | E29: of:=IF(IFNA(INDEX([$Doc.$B$1:$Doc.$B$1048576];MATCH([.$D29];[$Doc.$A$1:$Doc.$A$1048576];0);0); "")=0; "";IFNA(INDEX([$Doc.$B$1:$Doc.$B$1048576];MATCH([.$D29];[$Doc.$A$1:$Doc.$A$1048576];0);0); "")) -> 
C30: of:=IF(IFNA(INDEX([$Patients.$B$1:$Patients.$B$1048576];MATCH([.$B30];[$Patients.$A$1:$Patients.$A$1048576];0);0); "")=0; ""; IFNA(INDEX([$Patients.$B$1:$Patients.$B$1048576];MATCH([.$B30];[$Patients.$A$1:$Patients.$A$1048576];0);0); "")) ->  | E30: of:=IF(IFNA(INDEX([$Doc.$B$1:$Doc.$B$1048576];MATCH([.$D30];[$Doc.$A$1:$Doc.$A$1048576];0);0); "")=0; "";IFNA(INDEX([$Doc.$B$1:$Doc.$B$1048576];MATCH([.$D30];[$Doc.$A$1:$Doc.$A$1048576];0);0); "")) -> 
C31: of:=IF(IFNA(INDEX([$Patients.$B$1:$Patients.$B$1048576];MATCH([.$B31];[$Patients.$A$1:$Patients.$A$1048576];0);0); "")=0; ""; IFNA(INDEX([$Patients.$B$1:$Patients.$B$1048576];MATCH([.$B31];[$Patients.$A$1:$Patients.$A$1048576];0);0); "")) ->  | E31: of:=IF(IFNA(INDEX([$Doc.$B$1:$Doc.$B$1048576];MATCH([.$D31];[$Doc.$A$1:$Doc.$A$1048576];0);0); "")=0; "";IFNA(INDEX([$Doc.$B$1:$Doc.$B$1048576];MATCH([.$D31];[$Doc.$A$1:$Doc.$A$1048576];0);0); "")) -> 
C32: of:=IF(IFNA(INDEX([$Patients.$B$1:$Patients.$B$1048576];MATCH([.$B32];[$Patients.$A$1:$Patients.$A$1048576];0);0); "")=0; ""; IFNA(INDEX([$Patients.$B$1:$Patients.$B$1048576];MATCH([.$B32];[$Patients.$A$1:$Patients.$A$1048576];0);0); "")) ->  | E32: of:=IF(IFNA(INDEX([$Doc.$B$1:$Doc.$B$1048576];MATCH([.$D32];[$Doc.$A$1:$Doc.$A$1048576];0);0); "")=0; "";IFNA(INDEX([$Doc.$B$1:$Doc.$B$1048576];MATCH([.$D32];[$Doc.$A$1:$Doc.$A$1048576];0);0); "")) -> 
C33: of:=IF(IFNA(INDEX([$Patients.$B$1:$Patients.$B$1048576];MATCH([.$B33];[$Patients.$A$1:$Patients.$A$1048576];0);0); "")=0; ""; IFNA(INDEX([$Patients.$B$1:$Patients.$B$1048576];MATCH([.$B33];[$Patients.$A$1:$Patients.$A$1048576];0);0); "")) ->  | E33: of:=IF(IFNA(INDEX([$Doc.$B$1:$Doc.$B$1048576];MATCH([.$D33];[$Doc.$A$1:$Doc.$A$1048576];0);0); "")=0; "";IFNA(INDEX([$Doc.$B$1:$Doc.$B$1048576];MATCH([.$D33];[$Doc.$A$1:$Doc.$A$1048576];0);0); "")) -> 
C34: of:=IF(IFNA(INDEX([$Patients.$B$1:$Patients.$B$1048576];MATCH([.$B34];[$Patients.$A$1:$Patients.$A$1048576];0);0); "")=0; ""; IFNA(INDEX([$Patients.$B$1:$Patients.$B$1048576];MATCH([.$B34];[$Patients.$A$1:$Patients.$A$1048576];0);0); "")) ->  | E34: of:=IF(IFNA(INDEX([$Doc.$B$1:$Doc.$B$1048576];MATCH([.$D34];[$Doc.$A$1:$Doc.$A$1048576];0);0); "")=0; "";IFNA(INDEX([$Doc.$B$1:$Doc.$B$1048576];MATCH([.$D34];[$Doc.$A$1:$Doc.$A$1048576];0);0); "")) -> 

Sheet: Inventory
A1: Name | B1: Quantity | C1: Use Case | D1: Source
A2: Medikinet | B2: 1
A3: Medikanot | B3: 10
A4: Medikentat

Sheet: Checklist
A1: Has the person been here before? | B1: yes
A2: What is the Persons ID | B2: P1
A3: Is the Data still correct? | B3: yes
A4: What is the current Problem? | B4: Soo many problems
A5: Expertise which would help | B5: Pills
A6: Last Doc | B6: of:=INDEX([$Patients.$L$1:$Patients.$L$1048576];MATCH([.$B$2];[$Patients.$A$1:$Patients.$A$1048576];0);0) -> Don
A7: Does the last doc have the expertise? | B7: yes
A8: ID of doctor chosen | B8: D3
A9: Date of appointment | B9: 2020-03-20
A10: Time of appointment | B10: PT09H00M00S
A11: Did the Patient receive medication | B11: yes
A12: Did you update the Inventory? | B12: yes

Sheet: Handout
A1: Guten Tag, wir überweisen ihnen den Patienten: | B1: of:=INDEX([$Patients.$B$1:$Patients.$B$1048576];MATCH([$Checklist.$B2];[$Patients.$A$1:$Patients.$A$1048576];0);0) -> Powell
A2: Beschwerden des Patienten:
A3: of:=[$Checklist.$B4] -> Soo many problems
A27: Vielen Dank und schöne Grüße
A28: Ihr Medibüro
A33: _____________________________ | B33: _______________________
A35: Your Appointment
A37: Who | B37: of:=INDEX([$Doc.$B$1:$Doc.$B$1048576];MATCH([$Checklist.$B8];[$Doc.$A$1:$Doc.$A$1048576];0);0) -> Don
A38: Date | B38: of:=[$Checklist.$B9] -> 2020-03-20
A39: Time | B39: of:=[$Checklist.$B10] -> PT09H00M00S
A40: Address | B40: of:=INDEX([$Doc.$J$1:$Doc.$J$1048576];MATCH([$Checklist.$B$8];[$Doc.$A$1:$Doc.$A$1048576];0);0) -> Adress2
A41: Opening Hours | B41: of:=IFNA(IF(INDEX([$Doc.$K$1:$Doc.$K$1048576];MATCH([$Checklist.$B$8];[$Doc.$A$1:$Doc.$A$1048576];0);0)=0; ""; INDEX([$Doc.$K$1:$Doc.$K$1048576];MATCH([$Checklist.$B$8];[$Doc.$A$1:$Doc.$A$1048576];0);0));"") -> 

Sheet: To do list
A1: Who needs this | B1: What needs to be done | C1: Until when | D1: Who wants to do it